order_id,user_name,content,,
1871,舜网新闻中心,新型冠状病毒知识问答指导手册,2020年2月10日,舜网新闻中心
1872,重庆市人民政府,重庆市新型冠状病毒肺炎疫情防控工作领导小组关于进一步加强疫情防...,2020年2月9日,重庆市人民政府
1873,新民网,陈焕春:在湖北省新闻发布会上“新型冠状病毒属于SARS病毒”的表...,2020年2月10日,新民网
1874,一财网,钟南山:新型冠状病毒和SARS是两回事,2020年2月9日,一财网
1875,证券时报网,钟南山:新型冠状病毒是冠状病毒的一种 与SARS冠状病毒平行,2020年2月9日,证券时报网
1876,科技部,科技部关于发布新型冠状病毒(2019-nCoV)现场快速检测产品研发...,2020年2月8日,科技部
1877,黑龙江省人民政府,黑龙江省应对新型冠状病毒感染肺炎疫情指挥部第10号公告,2020年2月8日,黑龙江省人民政府
1878,北方网,《新型冠状病毒肺炎疫情心理防护手册》极速上线扫码阅读手机版,2020年2月7日,北方网
1879,风闻社区,武汉新型冠状病毒肺炎大事记(2019年12月—2020年1月20日),2020年2月7日,风闻社区
1880,河南省人民政府,河南省新型冠状病毒感染的肺炎疫情防控工作第五场新闻发布会,2020年2月7日,河南省人民政府
1881,河南省人民政府,河南省新型冠状病毒感染的肺炎疫情防控指挥部关于进一步加强生活...,2020年2月7日,河南省人民政府
1882,合肥新闻资讯,安徽省新型冠状病毒感染肺炎确诊病例数据分析,2020年2月7日,合肥新闻资讯
1883,湖南省人民政府,"湖南新增新型冠状病毒感染的肺炎确诊病例61例,累计出院病例91例",2020年2月7日,湖南省人民政府
1884,深圳政府在线,深圳市新型冠状病毒感染的肺炎疫情防控指挥部印发关于建立健全社区...,2020年2月6日,深圳政府在线
1885,岳阳市人民政府,新型冠状病毒肺炎确诊病例基本信息,2020年2月5日,岳阳市人民政府
1886,长江网,"有关新型冠状病毒感染肺炎疫情防控法律知识,都在这23问里",2020年2月6日,长江网
1887,江海明珠网,南通首批新型冠状病毒感染的肺炎患者治愈出院,2020年2月6日,江海明珠网
1888,金融界,湖北新增新型冠状病毒感染的肺炎病例2987例 累计19665例,2020年2月6日,金融界
1889,新浪地产网,《新型冠状病毒感染的肺炎传染病应急医疗设施设计标准》今日发布实...,2020年2月6日,新浪地产网
1890,东方网,新型冠状病毒会被雪花带到地面?专家:不用担心,2020年2月6日,东方网
1891,IT之家,新型冠状病毒如何影响全球光纤市场,2020年2月6日,IT之家
1892,腾讯,"绝了!印度政客居然称这样可以预防感染新冠病毒,网友:这很印度",5小时前,腾讯
1893,搜狐,台湾新增7例本地新冠病例 当局宣布“已进入社区感染”,22小时前,搜狐
1894,网易,世卫组织:44个国家或地区发现印度报告的变异新冠病毒感染病例,6小时前,网易
1895,CCTV节目官网,[朝闻天下]德国 德内政部长感染新冠 已接种一剂辉瑞疫苗,7小时前,CCTV节目官网
1896,搜狐,"台湾新增7例本土新冠肺炎确诊病例,其中6例感染源不明",20小时前,搜狐
1897,每日经济,俄罗斯单日新增新冠病毒感染病例8115例,1小时前,每日经济
1898,中国西藏网,德国内政部长确诊感染新冠病毒 系第二位内阁部长确诊,5小时前,中国西藏网
1899,北方网,雪上加霜!印度多地新冠患者感染罕见“毛霉菌病”扫码阅读手机版,5小时前,北方网
1900,每日经济,巴西新冠病毒感染病例数超过1520万例,2小时前,每日经济
1901,中国西藏网,德国内政部长感染新冠病毒 此前已接种一剂辉瑞疫苗,5小时前,中国西藏网
1902,新浪,感染新冠像被卡车撞了 国王小将回归保持乐观,4小时前,新浪
1903,国际在线,印度多名新冠康复者感染毛霉菌病 部分患者失明,2021年5月10日,国际在线
1904,中国新闻网,"韩国军舰上首次出现新冠疫情大暴发,已有38名舰员感染",2021年5月8日,中国新闻网
1905,环球网,澳大利亚男子在印度感染新冠后死亡 女儿发公开信怒斥澳政府,2021年5月8日,环球网
1906,网易,"韩国军舰首次新冠疫情大暴发,已有38名舰员感染",2021年5月8日,网易
1907,网易,"感染新冠还不消停,巴西总统抹黑中国发动“生物战”",2021年5月7日,网易
1908,凤凰网,"凤凰驻印度记者感染新冠:10天暴瘦10斤,曾写下“遗书”",2021年5月7日,凤凰网
1909,人民网,尼泊尔珠峰大本营17人确诊感染新冠,2021年5月7日,人民网
1910,网易,"怎么治的?泰国男子感染新冠,“治愈出院”没走到家就街头倒地断气...",2021年5月9日,网易
1911,凤凰网,"致死率达50%?印度新冠患者现罕见后遗症,已超200人感染!",21小时前,凤凰网
1912,搜狐,"致死率达50%?印度新冠患者现罕见后遗症,已超200人感染!正发生...",18小时前,搜狐
1913,网易号,"印度女子感染新冠住院,遭男性新冠患者乱摸,已经不是第一次发生",2021年5月6日,网易号
1914,搜狐,"好莱坞最赚钱男星感染新冠,在他之前有多位影星感染,一人已死亡",2021年5月6日,搜狐
1915,环球网,肯尼亚报告5例印度发现的变异新冠病毒感染病例,2021年5月6日,环球网
1916,腾讯,"美国传染病专家在印度感染新冠病毒去世,此前已完成疫苗注射",2021年5月5日,腾讯
1917,中华网,中疾控:3名回国人员疑从印度感染变异新冠病毒,2021年5月5日,中华网
1918,搜狐,泰国总理府11名工作人员感染新冠病毒 感染人数可能继续增加,2021年5月5日,搜狐
1919,腾讯,"新冠疫苗也救不了印度?美国专家在印感染新冠去世,此前已经接种",2021年5月5日,腾讯
1920,新华网,调查显示英国部分地区中学新冠感染显著下降,2021年5月5日,新华网
1921,新华网体育,德体育医学专家:感染新冠或长期影响运动员职业生涯,2021年5月5日,新华网体育
1922,凤凰网,"美传染病专家赴印度感染新冠去世,此前已注射两针疫苗",2021年5月4日,凤凰网
1923,网易号,"印度留学生感染新冠,中国网友弹幕刷屏了…",2021年5月1日,网易号
1924,环球网,香港首次出现本地感染变异新冠病毒案例 源头不明,2021年4月30日,环球网
1925,中国新闻网,台湾华航机师感染新冠肺炎疫情扩大 新增2人确诊,2021年4月26日,中国新闻网
1926,人民网,台湾华航感染新冠肺炎事件确诊增至7人,2021年4月26日,人民网
1927,中国青年网,台湾华航7名飞行员感染新冠 不排除是同一事件,2021年4月25日,中国青年网
1928,凤凰网科技,研究显示孕妇感染新冠病毒会致更高健康风险,2021年4月24日,凤凰网科技
1929,环球网,蒙古国首次发现变异新冠病毒感染病例,2021年4月24日,环球网
1930,凤凰军事,韩国海军突发舰上大规模新冠疫情:同一艘登陆舰33人确诊感染,2021年4月23日,凤凰军事
1931,中国日报网,加拿大首次发现变异新冠病毒B.1.617的感染病例,2021年4月22日,中国日报网
1932,央视网,中疾控调查报告:西安一名医院检验人员接种新冠疫苗仍被感染原因找...,2021年4月21日,央视网
1933,腾讯,泰国著名男星Pong也感染新冠了,2021年4月19日,腾讯
1934,腾讯,"打完新冠疫苗的人,究竟有多少又被感染和死亡?",2021年4月18日,腾讯
1935,央视网,新西兰新冠隔离酒店连续发生工作人员感染,2021年4月12日,央视网
1936,光明网,忧新冠感染激增 东京都拟实施“蔓延防止”等措施,2021年4月9日,光明网
1937,人民网,美国疾控中心:变异新冠病毒感染病例持续增加且年轻化,2021年4月9日,人民网
1938,光明网,美国疾控中心:变异新冠病毒感染病例持续增加且年轻化,2021年4月8日,光明网
1939,国际在线,美国疾控中心:变异新冠病毒感染病例持续增加且年轻化,2021年4月8日,国际在线
1940,凤凰网科技,丹麦发现新冠病毒变异毒株 可致二次感染,2021年4月5日,凤凰网科技
1941,环球网,日本自卫队驻吉布提基地突发同时确诊两例新冠感染病例,2021年4月4日,环球网
1942,人民网,出游季节临近!日本多地的新冠感染病例激增 专家担心疫情反弹,2021年3月26日,人民网
1943,光明网,接种新冠疫苗后为何仍会感染?权威解答在此,2021年3月24日,光明网
1944,中国新闻网,日本首现变异新冠病毒死亡病例 感染路径不明,2021年3月17日,中国新闻网
1945,人民网,12人确诊 日本千叶县首次发生变异新冠病毒群聚感染事件,2021年3月16日,人民网
1946,参考消息网,外媒:同时感染两种新冠病毒变种会发生什么?,2021年3月5日,参考消息网
1947,中国新闻网,美国日增新冠感染数为何显著下降?专家指出这些原因,2021年2月18日,中国新闻网
1948,中国新闻网,乌兹别克斯坦报告首例变异新冠病毒感染病例,2021年1月31日,中国新闻网
1949,央广网,美一病例感染新冠十余月未痊愈 患者:我大部分时间下不了床,2021年1月30日,央广网
1950,网易,感染1亿人的新冠病毒 竟然是美国研发的?,2021年1月28日,网易
1951,央视网,希金斯感染新冠缺席德国赛 成第二位确诊世界冠军,2021年1月27日,央视网
1952,网易科技,"多地动物感染新冠病毒,科学家称未来宠物也须接种疫苗",2021年1月26日,网易科技
1953,网易号,"全球首例!它也感染新冠病毒了,新冠实在太可怕,什么都不放过",2021年1月20日,网易号
1954,参考消息网,外媒:细胞可“记忆”新冠病毒 康复后半年内能抵抗再感染,2021年1月19日,参考消息网
1955,网易号,"新冠病毒感染是可以留下后遗症的,切勿放松警惕.",2021年1月15日,网易号
1956,网易旅游,美国一动物园至少2头大猩猩感染新冠病毒,2021年1月13日,网易旅游
1957,中国网,斯诺克——特鲁姆普感染新冠,2021年1月11日,中国网
1958,人民网,山东发现首例新冠变异毒株感染确诊患者,2021年1月6日,人民网
1959,人民网,亚美尼亚总统确诊感染新冠病毒,2021年1月6日,人民网
1960,网易新闻,中国男子在俄感染新冠 付费找人篡改检测报告回国,2020年12月29日,网易新闻
1961,光明网,感染新冠病毒后免疫力至少维持8个月,2020年12月24日,光明网
1962,光明网,感染新冠病毒后免疫力至少维持8个月,2020年12月24日,光明网
1963,网易新闻,美媒:美国五分之一囚犯感染新冠,2020年12月19日,网易新闻
1964,中国日报网,韩国新增1014例新冠病毒感染病例,2020年12月17日,中国日报网
1965,英语点津,英国发现新冠病毒新变种 感染人数超1000例,2020年12月15日,英语点津
1966,英语点津,英国发现新冠病毒新变种 感染人数超1000例,2020年12月15日,英语点津
1967,网易科技,"感染新冠病毒,马斯克:已从低烧、感冒等症状中完全恢复",2020年11月19日,网易科技
1968,英语点津,美国超100万儿童感染新冠病毒,2020年11月18日,英语点津
1969,人民网,世卫组织调查总部人员新冠聚集性感染,2020年11月18日,人民网
1970,中国日报网,全球抗击新冠政策大比拼:零新冠感染病例政策 Vs. 与新冠病毒共存政策,2020年11月16日,中国日报网
1971,观点中国,全球抗击新冠政策大比拼:零新冠感染病例政策 Vs. 与新冠病毒共存政策,2020年11月11日,观点中国
1972,网易,新冠伤大脑?有新冠患者诊断出精神疾病,2020年11月11日,网易
1973,人民网,欧洲评估新冠感染传播率及严重程度,2020年11月4日,人民网
1974,人民网,婴儿感染新冠病毒途径或查明,2020年10月21日,人民网
1975,中国青年网,研究发现:新冠二次感染或症状更严重,2020年10月15日,中国青年网
1976,央广网,研究发现新冠病毒感染人类的新路径,2020年10月11日,央广网
1977,中国网,美国专家担忧新冠病毒感染出现激增,2020年9月28日,中国网
1978,光明网,美国专家担忧新冠病毒感染出现激增,2020年9月27日,光明网
1979,腾讯,已有1亿多美国人感染新冠病毒?美专家:确诊人数被严重低估,2020年9月10日,腾讯
1980,网易体育,姆巴佩确诊新冠阳性!刚踢完欧国联 巴黎7人感染,2020年9月8日,网易体育
1981,新华网体育,曼城两球员感染新冠病毒,2020年9月7日,新华网体育
1982,环球网,巨石强森自爆感染新冠,2020年9月4日,环球网
1983,英语点津,美国大学新冠感染病例激增 近半数教师不想干了……,2020年9月1日,英语点津
1984,光明网,新冠二次感染病例带来哪些防疫启示,2020年8月27日,光明网
1985,人民网,香港大学证实有康复者二次感染新冠病毒 属全球首例,2020年8月25日,人民网
1986,中华网,新冠病毒这样感染健康细胞,2020年8月22日,中华网
1987,中华网,石田纯一感染新冠相关新闻_图片_视频_网友讨论_头条_中华网,2020年8月20日,中华网
1988,人民网,韩国检出3例变异新冠病毒 京畿道教会集体感染出现第4代,2020年8月12日,人民网
1989,光明网,英国发现首例感染新冠病毒宠物猫,2020年7月30日,光明网
1990,央视网,"国家安全顾问感染新冠,特朗普回应:我最近没见过他",2020年7月28日,央视网
1991,人民网,韩军边防部队集体感染新冠病毒 至少确诊8例,2020年7月22日,人民网
1992,央视网,孕妇确诊感染新冠病毒是否会传染胎儿?专家回应,2020年7月13日,央视网
1993,中国日报网,"美国亚特兰大市长确诊新冠肺炎:病毒传染力太强,我都不知道怎么感...",2020年7月7日,中国日报网
1994,腾讯体育,NBA新冠病毒感染者汇总:至少36人次感染 涵盖至少13支球队,2020年7月1日,腾讯体育
1995,腾讯体育,NBA新冠病毒感染者汇总:至少36人次感染 涵盖至少13支球队,2020年7月1日,腾讯体育
1996,凤凰网,"美国新冠实际感染2400万,白宫紧急召开记者会,终于要抄中国作业了...",2020年6月27日,凤凰网
1997,凤凰网,"美国新冠实际感染2400万,白宫紧急召开记者会,终于要抄中国作业了...",2020年6月27日,凤凰网
1998,新浪,斯皮思大师赛后感染上新冠 从极度难受到完全康复,5小时前,新浪
1999,河南一百度,世卫组织:44个国家或地区发现印度报告的变异新冠病毒感染病例,5小时前,河南一百度
2000,川观新闻,世卫组织:44个国家或地区发现印度报告的变异新冠病毒感染病例,6小时前,川观新闻
2001,东南网,台湾新增7例本地新冠病例 当局宣布“已进入社区感染”,7小时前,东南网
2002,曲阜网,多国发现印度变异新冠病毒感染病例 究竟是什么病毒??,9小时前,曲阜网
2003,新浪财经,马来西亚卫生部:已发现4例确诊病例分别感染3种变异新冠病毒,19小时前,新浪财经
2004,中国行业研究网,多国发现印度变异新冠病毒感染病例 2021新冠疫苗市场份额分析,20小时前,中国行业研究网
2005,每日经济,乌克兰单日新增新冠病毒感染病例2817例,20小时前,每日经济
2006,每经网,菲律宾:已发现两例在印度首次发现的新冠变异病毒感染病例,21小时前,每经网
2007,海峡网,"疫情升温!台湾新增7例本地新冠确诊病例,6例感染源不明",21小时前,海峡网
2008,汇金网,最新报道THE LATEST REPORT,21小时前,汇金网
2009,西陆军事,多国发现印度变异新冠病毒感染病例 多注意防范!,2021年5月11日,西陆军事
2010,西陆军事,多国发现印度变异新冠病毒感染病例 多注意防范!,2021年5月11日,西陆军事
2011,新浪网,印度专家证实部分新冠患者感染罕见的“毛霉菌病”,2021年5月10日,新浪网
2012,和讯财经新闻,"确诊感染变异新冠病毒后,印度男子在港隐瞒行程还连续聚会:多人...",2021年5月9日,和讯财经新闻
2013,新浪,韩国军舰上首次出现新冠疫情大暴发 38名舰员感染,2021年5月8日,新浪
2014,新浪网,韩国军舰首次出现新冠疫情大暴发 已有38名舰员感染,2021年5月8日,新浪网
2015,华商网,印度一73岁父亲感染新冠去世 火化时小女儿突然跳入火堆,2021年5月6日,华商网
2016,直播吧,"医学专家:感染新冠或长期影响运动员生涯,足球界大多轻描淡写",2021年5月6日,直播吧
2017,新浪,奥预赛曝新冠感染病例 赛艇队成员在东京确诊阳性,2021年5月6日,新浪
2018,澎湃,"专家曝感染新冠或长期影响运动员生涯,欧洲足坛却轻描淡写",2021年5月5日,澎湃
2019,界面新闻,英政府调查:英国部分地区中学新冠感染比例显著下降,2021年5月5日,界面新闻
2020,新浪财经,东京奥运会圣火传递出现新冠病毒集体感染事件 已有6人确诊,2021年5月2日,新浪财经
2021,驱动之家,东京奥运会圣火传递出现新意外!出现新冠病毒集体感染:6人确诊,2021年5月2日,驱动之家
2022,内蒙古新闻网,如果感染了新冠病毒危害大吗?如何预防?,2021年5月2日,内蒙古新闻网
2023,新浪互动资料库,男团Travis Japan6人感染新冠 有成员第二次感染,2021年4月30日,新浪互动资料库
2024,中财网,美国疾控中心模型推演:全美新冠感染人数或已超1.1亿人,2021年4月30日,中财网
2025,中财网,美国疾控中心模型推演:全美新冠感染人数或已超1.1亿人,2021年4月30日,中财网
2026,观察者网,美国疾控中心模型推演:全美新冠感染人数或已超1.1亿人,2021年4月30日,观察者网
2027,观察者网,美国疾控中心模型推演:全美新冠感染人数或已超1.1亿人,2021年4月30日,观察者网
2028,驱动之家,快接种!一剂新冠疫苗就能降低家庭近50%感染病毒的几率,2021年4月29日,驱动之家
2029,游侠网,印度记者感染新冠网上求助 竟成了自己的“死亡直播”,2021年4月28日,游侠网
2030,海峡网,"印度男子杀害感染新冠妻子后跳楼:新冠疫情失控,惨剧在印度不断上演",2021年4月28日,海峡网
2031,上海热线,"印度新冠疫情近乎失控,一男子杀害感染新冠妻子后跳楼",2021年4月28日,上海热线
2032,新浪网,"惨惨惨!印度记者感染新冠在网上求救,却直播了自己的死亡",2021年4月27日,新浪网
2033,民航资源网,台湾华航机师感染新冠疫情扩大 新增2人确诊,2021年4月27日,民航资源网
2034,新浪网,"一位印度记者,感染新冠在网上求救,却直播了自己的死亡",2021年4月27日,新浪网
2035,和讯财经新闻,"新冠感染风暴持续撼动印度,哪些国家和地区已发布对印入境限制措施",2021年4月27日,和讯财经新闻
2036,川观新闻,台湾华航感染新冠肺炎事件确诊增至7人 感染源仍不明,2021年4月25日,川观新闻
2037,界面新闻,"台湾华航感染新冠肺炎事件确诊增至7人,感染源仍不明",2021年4月25日,界面新闻
2038,民航资源网,台湾华航7名飞行员感染新冠 不排除是同一事件,2021年4月25日,民航资源网
2039,澎湃,"涉嫌蓄意传播新冠病毒致22人感染,西班牙一男子被捕",2021年4月25日,澎湃
2040,新浪网,"新冠感染人数超50万,美学者吹捧:美国是疫情最大赢家",2021年4月24日,新浪网
2041,科学网,研究显示孕妇感染新冠病毒会致更高健康风险,2021年4月24日,科学网
2042,新浪,蒙古国首次发现变异新冠病毒感染病例,2021年4月24日,新浪
2043,新浪,新加坡11名外籍劳工确诊感染新冠病毒 10人疑似再度感染,2021年4月22日,新浪
2044,每经网,中疾控调查报告:西安一名医院检验人员接种新冠疫苗仍被感染原因找...,2021年4月21日,每经网
2045,中金在线,决策分析:大跌原因找到了!新冠感染“惊人增长”引爆避险 美股原油...,2021年4月21日,中金在线
2046,证券时报网,"新冠感染激增,日本宣布将进入紧急状态,印度疫情失控",2021年4月21日,证券时报网
2047,中国台湾网,台湾新增2例新冠肺炎确诊病例 感染源不明,2021年4月20日,中国台湾网
2048,新浪互动资料库,日本新冠感染人数不断增加 接连曝出艺人明星感染,2021年4月15日,新浪互动资料库
2049,中国宁波网,新冠感染人数激增 印度宣布禁止出口抗病毒药物瑞德西韦,2021年4月12日,中国宁波网
2050,新民网,美国疾控中心主任:美国多地变异新冠感染病例增加,2021年4月10日,新民网
2051,news.ycwb.com,美国报告逾2万例变异新冠病毒感染病例,2021年4月10日,news.ycwb.com
2052,中国宁波网,美疾控中心:变异新冠病毒感染病例持续增加且年轻化,2021年4月9日,中国宁波网
2053,直播吧,"米体:就算有多名球员感染新冠,意甲联赛也不会因此停摆",2021年4月2日,直播吧
2054,东莞阳光网,接种新冠疫苗后为何仍会感染?权威解答在此,2021年3月24日,东莞阳光网
2055,头条前瞻,"法国发现可逃过核酸检测的新冠病毒变种,感染8人全部死亡",2021年3月18日,头条前瞻
2056,中关村在线,胖子感染新冠肺炎更致命 美国专家有了新发现,2021年3月11日,中关村在线
2057,海外网,多种变异新冠病毒在美国蔓延 已致3100多人感染,2021年3月8日,海外网
2058,新民网,美国近320万儿童感染新冠病毒,2021年3月3日,新民网
2059,news.henu.edu.cn,我校本科生关注新冠病毒感染对国家安全的影响,2021年2月28日,news.henu.edu.cn
2060,华图教育,『美国多地出现新冠病毒变异株』已有近2000例变异新冠病毒感染病例,2021年2月26日,华图教育
2061,头条前瞻,"首例!美国女子移植双肺后感染新冠死亡,敲响器官移植警钟",2021年2月24日,头条前瞻
2062,荔枝网,美国日增新冠感染数为何显著下降?专家指出这些原因,2021年2月18日,荔枝网
2063,中关村在线,英国真人挑战:90人主动感染新冠病毒,2021年2月18日,中关村在线
2064,金投网,韩国新冠集体感染事件频出 “三密”工作环境也是一大因素,2021年2月7日,金投网
2065,燕赵都市报,世卫专家:儿童感染新冠大多无症状,2021年2月1日,燕赵都市报
2066,北京商报,"钟南山:现在感染新冠病毒大多是轻症,但传播率很强",2021年1月31日,北京商报
2067,卡车之家,卡友感染新冠 连身份证号码都被公布了,2021年1月28日,卡车之家
2068,杭州网,墨西哥总统感染新冠病毒,2021年1月26日,杭州网
2069,四海网,特朗普如何感染新冠?特朗普感染新冠的原因被透露,2021年1月25日,四海网
2070,雷科技,"感染1亿人的新冠病毒,竟然是美国研发的?",2021年1月25日,雷科技
2071,海外网,"美国一家18口感染新冠:最小仅1岁,最大62岁",2021年1月20日,海外网
2072,嵊州新闻网,感染过新冠病毒还需接种疫苗吗?看完这篇就明白了,2021年1月20日,嵊州新闻网
2073,新浪网,美国一科学家感染新冠:曾因拒绝疫情造假 被特工持枪搜家,2021年1月19日,新浪网
2074,华商网,最新!意大利一女子2019年11月已感染新冠,2021年1月12日,华商网
2075,百战网,新冠病毒源头?意大利一女子19年11月已感染新冠 这是目前发现最早...,2021年1月12日,百战网
2076,健康界,河北最新通报45名儿童感染新冠!有些话不得不说,2021年1月12日,健康界
2077,中关村在线,癌症晚期患者感染新冠病毒:神器痊愈 真能治癌?,2021年1月11日,中关村在线
2078,金投网,感染新冠后肿瘤消失 一个值得探究的“医学奇迹”,2021年1月11日,金投网
2079,百战网,"感染新冠后肿瘤消失,癌症晚期患者竟因祸得福",2021年1月11日,百战网
2080,一财网,俄境内发现首例英国报告的变异新冠病毒感染病例,2021年1月11日,一财网
2081,一财网,韩国已累计出现15例变异新冠病毒感染病例,2021年1月7日,一财网
2082,中国台湾网,台湾新增1例变异新冠病毒感染病例 全台累计5例,2021年1月7日,中国台湾网
2083,cnBeta,"新冠患者是否还会再次感染病毒?--可能,但不多见",2021年1月7日,cnBeta
2084,卡车之家,事发紧急!一卡友途径石家庄后感染新冠,2021年1月6日,卡车之家
2085,桂林生活网,美国著名主持人感染新冠!,2021年1月3日,桂林生活网
2086,科学网,马耳他发现3例变异新冠病毒感染病例,2020年12月31日,科学网
2087,大公网,疾控中心:国内人群处于新冠病毒低感染水平,2020年12月29日,大公网
2088,复禾健康,"北京新冠感染升至13人,病源来自何处?",2020年12月28日,复禾健康
2089,观察者网,外媒:智利研究基地36人感染新冠病毒,2020年12月22日,观察者网
2090,四海网,印度已有近8亿人感染新冠 60%的人感染新冠病毒数字惊人,2020年12月21日,四海网
2091,观察者网,"英国出现新冠变异病毒,感染已超1000例",2020年12月15日,观察者网
2092,OFweek维科网,"美惊现新冠病毒超级传播源,一会议致24.5万人感染",2020年12月14日,OFweek维科网
2093,财富中文网,再次感染新冠真的罕见吗?英国真实世界的数据告诉你真相,2020年11月12日,财富中文网
2094,新浪网,警惕!12人确诊感染变异新冠病毒!源头竟是它.....,2020年11月6日,新浪网
2095,中国科学院,研究评估新冠感染传播率及严重程度,2020年11月4日,中国科学院
2096,健康界,"人民日报:这个条件,新冠病毒可长期存活",2020年10月21日,健康界
