order_id,user_name,content,,
1420,看看新闻网,石家庄应对新冠疫情工作会议:迅速进入战时状态,2021年1月4日,看看新闻网
1421,中关村在线,国内新冠疫情惊现1传21 出自同一家医院,2021年1月3日,中关村在线
1422,电子发烧友,新冠疫情大流行影响2020年物联网部署趋势 一些项目推迟,2020年12月24日,电子发烧友
1423,河北新闻网,新冠疫情对我国海外工程承包市场的影响分析,2020年12月17日,河北新闻网
1424,庐江县人民政府,郭河镇:新冠疫情防控工作再加力,2020年11月24日,庐江县人民政府
1425,至诚新闻,美国新冠疫情最新消息 美国新冠超1218万,2020年11月23日,至诚新闻
1426,头条前瞻,痛心!新冠疫情还没解决又带来环保难题 英国海滩上垃圾遍地,2020年11月6日,头条前瞻
1427,西陆网,"这两天的中国,全世界至少三个真的没想到了!",2020年10月16日,西陆网
1428,中国政府网,习近平:在全国抗击新冠肺炎疫情表彰大会上的讲话,2020年10月15日,中国政府网
1429,求是网,在全国抗击新冠肺炎疫情表彰大会上的讲话,2020年10月15日,求是网
1430,新民网,"欧洲各国全力阻击第二波新冠疫情,法国成情况最危急国家之一",2020年10月15日,新民网
1431,新浪网,国内多人确诊新冠 全球第二波疫情袭来,2020年10月13日,新浪网
1432,黑龙江省人民政府,黑龙江省抗击新冠肺炎疫情拟表彰对象公示,2020年10月10日,黑龙江省人民政府
1433,十堰市政府网,2020年10月8日十堰市新冠肺炎疫情情况,2020年10月9日,十堰市政府网
1434,西陆网,专家预测美国新冠疫情将这样结束,2020年10月3日,西陆网
1435,人人都是产品经理,新冠疫情对大健康行业带来了哪些改变?,2020年9月20日,人人都是产品经理
1436,新浪网,美国新冠病例数突破630万 最新研究显示感染人数仍被严重低估,2020年9月12日,新浪网
1437,中国军网,中国抗击新冠肺炎疫情全纪实,2020年9月7日,中国军网
1438,中国文明网,同舟共济战“疫”记——中国抗击新冠肺炎疫情全纪实,2020年9月7日,中国文明网
1439,中国宁波网,新华社万字长文:中国抗击新冠肺炎疫情全纪实,2020年9月7日,中国宁波网
1440,中国文明网,在磨难中砥砺复兴力量——中国抗击新冠肺炎疫情伟大斗争启示录,2020年9月7日,中国文明网
1441,新华日报,"2020,新冠疫情如何影响世界",2020年8月23日,新华日报
1442,中国教育部,教育部应对新冠肺炎疫情工作领导小组办公室,2020年8月20日,中国教育部
1443,中国教育部,科学指导学校疫情防控工作 有序推进秋季学期复学复课,2020年8月15日,中国教育部
1444,新浪网,西媒盘点新冠疫情暴发半年来的十个待解谜团,2020年7月31日,新浪网
1445,科学网,全球新冠确诊病例超958万 欧洲警惕疫情反弹,2020年6月26日,科学网
1446,长江网,2020年6月23日湖北省新冠肺炎疫情情况,2020年6月24日,长江网
1447,亿欧EqualOcean,"危中有机,“新冠疫情”下的企业供应链布局及策略",2020年6月11日,亿欧EqualOcean
1448,一财网,世界银行:新冠疫情使全球经济陷入二战以来最严重衰退,2020年6月8日,一财网
1449,国务院新闻办公室,《抗击新冠肺炎疫情的中国行动》白皮书(全文),2020年6月7日,国务院新闻办公室
1450,国务院新闻办公室,国新办举行《抗击新冠肺炎疫情的中国行动》白皮书发布会,2020年6月7日,国务院新闻办公室
1451,求是网,抗击新冠肺炎疫情的中国行动,2020年6月7日,求是网
1452,司法部,《抗击新冠肺炎疫情的中国行动》白皮书,2020年6月7日,司法部
1453,新浪,新冠疫情与中美关系再思考,2020年5月30日,新浪
1454,荆楚网,就新冠疫情在美国法院滥诉中国政府——彻头彻尾的违反国际法行为,2020年5月27日,荆楚网
1455,科学网,兰州大学发布全球新冠疫情预测系统,2020年5月26日,科学网
1456,新浪,"全球新冠病例超547万,美国两名确诊发型师或感染140人",2020年5月26日,新浪
1457,长江网,2020年5月25日湖北省新冠肺炎疫情情况,2020年5月26日,长江网
1458,新华网,做好新冠肺炎疫情常态化防控工作,2020年5月16日,新华网
1459,人民网,美国关于新冠肺炎疫情的涉华谎言与事实真相,2020年5月10日,人民网
1460,金融界,中国央行:2020年一季度突如其来的新冠肺炎疫情对我国经济社会发展...,2020年5月10日,金融界
1461,光明网,美国关于新冠肺炎疫情的涉华谎言与事实真相,2020年5月10日,光明网
1462,光明网,美国关于新冠肺炎疫情的涉华谎言与事实真相,2020年5月9日,光明网
1463,中国金融信息网,"冲击,难题,启示——写在新冠疫情构成“国际关注的突发公共卫生事...",2020年5月7日,中国金融信息网
1464,人民网,综合消息:拉美新冠疫情持续蔓延 巴西确诊超5万例,2020年4月26日,人民网
1465,观点中国,新冠疫情与冲突:七大趋势,2020年4月24日,观点中国
1466,中国网,新冠疫情缘何让原油变成“烫手山芋”,2020年4月23日,中国网
1467,中国日报网,《抗击新冠肺炎疫情的中国实践》报告全文,2020年4月21日,中国日报网
1468,中国新闻网,美国民众抗击新冠疫情的温情故事,2020年4月14日,中国新闻网
1469,人民网,深入学习贯彻习近平总书记关于新冠肺炎疫情防控的重要讲话精神 为打...,2020年4月11日,人民网
1470,人民网,疫情防控面对面:新冠病毒无症状感染者管理规范出台,2020年4月10日,人民网
1471,人民网,最高检发布6个涉新冠肺炎疫情严重暴力犯罪典型案例,2020年4月9日,人民网
1472,人民网,中国发布新冠肺炎疫情信息、推进疫情防控国际合作纪事,2020年4月7日,人民网
1473,人民网,北京基本阻断新冠肺炎疫情扩散蔓延 防控将常态化,2020年4月5日,人民网
1474,人民网,湖北14名新冠肺炎疫情防控一线牺牲人员被评定为首批烈士,2020年4月3日,人民网
1475,阳光高考,教育部关于应对新冠肺炎疫情 稳妥做好2020年全国普通高校招生工作...,2020年3月31日,阳光高考
1476,财新网,从全球角度看新冠疫情的影响及应对,2020年3月27日,财新网
1477,人民网,美国新冠肺炎疫情日益恶化,2020年3月27日,人民网
1478,参考消息,全球知名思想家预测:新冠疫情大流行后的世界会怎样,2020年3月25日,参考消息
1479,人民网,俄政府:新冠病毒疫情是近50年最严重的全球卫生危机之一,2020年3月20日,人民网
1480,人民网,新冠肺炎疫情给中国未来带来的五大变化,2020年3月18日,人民网
1481,光明网,新冠肺炎疫情给中国未来带来的五大变化,2020年3月17日,光明网
1482,人民网,欧洲加大力度防控新冠肺炎疫情,2020年3月17日,人民网
1483,人民网,习近平:坚决克服新冠肺炎疫情影响 坚决夺取脱贫攻坚战全面胜利,2020年3月9日,人民网
1484,证券时报网,深度解析丨新冠疫情全球蔓延对中国经济影响可以有多深?,2020年3月9日,证券时报网
1485,人民网,国际观察:新冠疫情对日本是“危”中有“机”,2020年2月24日,人民网
1486,和讯网,十年前有人神预言新冠疫情?真有人查了个底朝天,2020年2月24日,和讯网
1487,凤凰网科技,十年前有人神预言新冠疫情?真有人查了个底朝天,2020年2月24日,凤凰网科技
1488,新华网江苏频道,江苏9人被授予新冠肺炎疫情防控先进个人称号,2020年2月24日,新华网江苏频道
1489,东方财富网,意大利成欧洲新冠肺炎疫情最严重国家 11市镇封闭!意甲爆五大联赛...,2020年2月23日,东方财富网
1490,中国新闻网,“北大荒”抗击新冠肺炎疫情纪实,2020年2月17日,中国新闻网
1491,光明网,新冠肺炎疫情下我国经济面临的挑战、机遇与调控对策,2020年2月17日,光明网
1492,网易科技,受新冠病毒疫情影响 世界移动通信大会被取消,2020年2月13日,网易科技
1493,观点中国,"新冠疫情是全球危机,国际社会应公正对待华人特约",2020年2月11日,观点中国
1494,易车网,中国新冠病毒爆发疫情 国内外车企影响汇总,2020年2月7日,易车网
1495,北部湾在线,美国关于新冠肺炎疫情的涉华谎言与事实真相,2020年5月10日,北部湾在线
1496,深圳新闻网,美国关于新冠肺炎疫情的涉华谎言与事实真相,2020年5月10日,深圳新闻网
1497,看看新闻网,美国关于新冠肺炎疫情的涉华谎言与事实真相,2020年5月9日,看看新闻网
1498,南宁新闻网,美国关于新冠肺炎疫情的涉华谎言与事实真相,2020年5月9日,南宁新闻网
1499,湖南省人民政府,湖南省人民政府办公厅关于印发《应对新冠肺炎疫情影响进一步做好稳...,2020年4月30日,湖南省人民政府
1500,中国台湾网,非洲新冠疫情恶化?港媒:非洲正在沦为全球抗疫的“洼地”,2020年4月30日,中国台湾网
1501,中国军网,"新冠疫情发生以来,中国始终以实际行动支持非洲抗疫",2020年4月30日,中国军网
1502,观察者网,新冠疫情下的厄瓜多尔:尸体无处安放 第一大城市成＂人间地狱＂,2020年4月15日,观察者网
1503,电子发烧友,因新冠疫情影响 2020年全球半导体收入将下降0.9%,2020年4月10日,电子发烧友
1504,湖南省人民政府,中国发布新冠肺炎疫情信息、推进疫情防控国际合作纪事,2020年4月8日,湖南省人民政府
1505,北京市人民政府,中国发布新冠肺炎疫情信息、推进疫情防控国际合作纪事,2020年4月7日,北京市人民政府
1506,新华网,截至5月11日24时新型冠状病毒肺炎疫情最新情况,5小时前,新华网
1507,人民网,5月11日河北省无新增新型冠状病毒肺炎确诊病例 无新增无症状感染者,4小时前,人民网
1508,腾讯,2021年5月11日江西省新型冠状病毒肺炎疫情情况,1小时前,腾讯
1509,中国新闻网,吉林省卫生健康委关于新型冠状病毒肺炎疫情情况通报(2021年5月12...,5小时前,中国新闻网
1510,搜狐,2021年5月10日江西省新型冠状病毒肺炎疫情情况,15小时前,搜狐
1511,人民网,5月10日贵州省无新增新型冠状病毒肺炎确诊及疑似病例,5小时前,人民网
1512,新华网,2021年5月11日0时至24时辽宁新型冠状病毒肺炎疫情情况,5小时前,新华网
1513,搜狐,四川省新型冠状病毒肺炎疫情最新情况(5月11日发布),2021年5月11日,搜狐
1514,腾讯,“现在放松还为时过早”第四次冠状病毒可能随时到来,17小时前,腾讯
1515,搜狐,5月11日湖州市新型冠状病毒肺炎疫情通报,17小时前,搜狐
1516,四川省人民政府,四川省新型冠状病毒肺炎疫情最新情况(5月12日发布),5小时前,四川省人民政府
1517,网易,突发!美国放弃疫苗知识产权!全美疫情7月将＂急剧下降＂,2021年5月6日,网易
1518,网易,"印度疫情太猛了,连狮子也被确诊感染新冠",2021年5月5日,网易
1519,搜狐,新型冠状病毒肺炎疫情形势快报(第61期),2021年4月28日,搜狐
1520,腾讯,为什么第二轮冠状病毒浪潮席卷印度,2021年4月24日,腾讯
1521,搜狐,在冠状病毒期间区分物联网事实与虚构,2021年4月24日,搜狐
1522,网易,"印度再次刷新了世界纪录,单日新增病例达到了33万",2021年4月24日,网易
1523,搜狐,冠状病毒疫情对云计算采用的持久影响,2021年4月23日,搜狐
1524,网易,突发!完全接种疫苗的清洁工在飞机上接触病毒后被感染,2021年4月20日,网易
1525,光明网,我国首个《间充质干细胞治疗新型冠状病毒肺炎专家共识》发布,2021年4月10日,光明网
1526,搜狐,【新型冠状病毒科普知识】未完成全程免疫程序接种者如何进行补种?...,18小时前,搜狐
1527,光明网,新型冠状病毒肺炎科研成果学术交流平台,2021年4月7日,光明网
1528,央视网,梁万年:蝙蝠和穿山甲中的冠状病毒不是新冠病毒的直接祖先,2021年3月31日,央视网
1529,中华网,新冠状病毒相关新闻_图片_视频_网友讨论_头条_中华网,2021年3月24日,中华网
1530,中青在线,中科院研发重组新型冠状病毒疫苗获准紧急使用,2021年3月17日,中青在线
1531,人民网,广东省疾控中心首次发现新型冠状病毒B.1.525尼日利亚突变株,2021年3月14日,人民网
1532,腾讯,"新型冠状病毒全球感染累计达1亿人,太可怕了!",2021年1月27日,腾讯
1533,腾讯,"新冠病毒源头究竟是哪?揭露美国最大生化基地,秘密储存各种冠状病毒",2021年1月20日,腾讯
1534,华声在线,"【辟谣侠盟】关于新型冠状病毒,这些谣言不可信! - 华声在线专题",2021年1月15日,华声在线
1535,人民网,1月14日河北新增90例本地新型冠状病毒肺炎确诊病例 石家庄84例 邢...,2021年1月15日,人民网
1536,网易新闻,截至12月28日24时新型冠状病毒肺炎疫情最新情况,2020年12月29日,网易新闻
1537,网易新闻,警惕!变异病毒VUI-202012/01出现了 传播更快,2020年12月21日,网易新闻
1538,腾讯,世界新型冠状病毒感染人数超过5000万、美国接近1000万,2020年11月9日,腾讯
1539,环球网,"高福:下一个冠状病毒就藏在某个地方休眠,而这种休眠随时可能被打破",2020年10月30日,环球网
1540,网易号,新型冠状病毒疫情实时数据可视化监测,2020年10月28日,网易号
1541,网易号,缅甸、印度将合作研发新型冠状病毒疫苗,2020年10月28日,网易号
1542,央广网,警惕!四种季节性冠状病毒会发生再感染,2020年9月17日,央广网
1543,新华网,新型冠状病毒肺炎防控方案第七版发布 对流行病学特征、疫情处置等进...,2020年9月16日,新华网
1544,光明网,敲响安全警钟!美实验室人造冠状病毒事故频发,2020年8月21日,光明网
1545,中华网,冠状病毒相关新闻_图片_视频_网友讨论_头条_中华网,2020年8月20日,中华网
1546,新华网,欧洲成立冠状病毒药物研发联盟,2020年8月19日,新华网
1547,环球网,广东陆丰通报一例新型冠状病毒肺炎病例活动轨迹,2020年8月15日,环球网
1548,人民网四川频道,四川调整新型冠状病毒相关检测项目价格和医保支付政策,2020年7月21日,人民网四川频道
1549,央广网,中国疾病预防控制中心公布“6月北京新型冠状病毒肺炎疫情进展”,2020年6月27日,央广网
1550,环球网,《纽约时报》热评:为什么美国要对外输出冠状病毒?,2020年6月25日,环球网
1551,中国小康网,截至5月11日24时新型冠状病毒肺炎疫情最新情况,2小时前,中国小康网
1552,新浪,截至5月11日24时新型冠状病毒肺炎疫情最新情况,2小时前,新浪
1553,川南在线,泸州市无新增新型冠状病毒肺炎确诊病例,3小时前,川南在线
1554,华夏经纬,2021年5月11日0时至24时辽宁新型冠状病毒肺炎疫情情况,3小时前,华夏经纬
1555,海南新闻,截至5月11日24时新型冠状病毒肺炎疫情最新情况,4小时前,海南新闻
1556,圈点,截至2021年5月11日24时河南省新型冠状病毒肺炎疫情最新情况,4小时前,圈点
1557,中国普法网,截至5月11日24时新型冠状病毒肺炎疫情最新情况,4小时前,中国普法网
1558,广西壮族自治区政府,截至5月11日24时新型冠状病毒肺炎疫情最新情况,4小时前,广西壮族自治区政府
1559,中国政府网,截至5月11日24时新型冠状病毒肺炎疫情最新情况,5小时前,中国政府网
1560,东南网美国频道,截至5月11日24时新型冠状病毒肺炎疫情最新情况,5小时前,东南网美国频道
1561,四川省人民政府,四川省新型冠状病毒肺炎疫情最新情况(5月12日发布),5小时前,四川省人民政府
1562,东南网,截至5月11日24时新型冠状病毒肺炎疫情最新情况,5小时前,东南网
1563,华奥星空网,截至5月11日24时新型冠状病毒肺炎疫情最新情况,5小时前,华奥星空网
1564,参考消息网,"2.5万年前,一种古老的冠状病毒曾席卷东亚",2021年4月25日,参考消息网
1565,中工网,截至5月11日24时新型冠状病毒肺炎疫情最新情况,5小时前,中工网
1566,四川省人民政府,截至5月11日24时新型冠状病毒肺炎疫情最新情况,5小时前,四川省人民政府
1567,新浪,截至5月11日24时全国新型冠状病毒肺炎疫情最新情况,6小时前,新浪
1568,新浪财经,"四川5月11日新增确诊病例1例、无症状感染者1例,均为境外输入",6小时前,新浪财经
1569,新浪网,31省区市新增确诊病例16例 均为境外输入病例,6小时前,新浪网
1570,中国江苏网,截至5月11日24时新型冠状病毒肺炎疫情最新情况,6小时前,中国江苏网
1571,郴州新闻网,截至5月11日24时新型冠状病毒肺炎疫情最新情况,14小时前,郴州新闻网
1572,中国常德,预防知识(按发稿时间排序),16小时前,中国常德
1573,城视网,关注:新型冠状病毒肺炎防控最新进展,16小时前,城视网
1574,齐鲁网,滕州市张汪中心卫生院召开《医疗机构内新型冠状病毒感染预防与控制...,20小时前,齐鲁网
1575,四川省人民政府,四川省新型冠状病毒肺炎疫情最新情况(5月10日发布),2021年5月10日,四川省人民政府
1576,中国政府网,截至5月9日24时新型冠状病毒肺炎疫情最新情况,2021年5月10日,中国政府网
1577,本地宝,南京新型冠状病毒疫情最新消息(持续更新),2021年5月10日,本地宝
1578,北京市人民政府,截至5月9日24时全国新型冠状病毒肺炎疫情最新情况,2021年5月10日,北京市人民政府
1579,四川省人民政府,截至5月9日24时新型冠状病毒肺炎疫情最新情况,2021年5月10日,四川省人民政府
1580,中国江苏网,截至5月9日24时新型冠状病毒肺炎疫情最新情况,2021年5月10日,中国江苏网
1581,新浪财经,2021年5月8日西藏自治区新型冠状病毒肺炎疫情情况,2021年5月9日,新浪财经
1582,南方财富网,"2021年新型冠状病毒上市公司龙头,新型冠状病毒上市公司有哪些?",2021年5月6日,南方财富网
1583,北京市人民政府,截至5月5日24时全国新型冠状病毒肺炎疫情最新情况,2021年5月6日,北京市人民政府
1584,湖州市人民政府,5月5日湖州市新型冠状病毒肺炎疫情通报,2021年5月5日,湖州市人民政府
1585,新浪网,2021年5月4日0时至24时辽宁新型冠状病毒肺炎疫情情况,2021年5月5日,新浪网
1586,本地宝,南京新型冠状病毒肺炎实时动态(更新中),2021年4月30日,本地宝
1587,湖州市人民政府,4月29日湖州市新型冠状病毒肺炎疫情通报,2021年4月29日,湖州市人民政府
1588,黄冈市人民政府,截至4月28日24时新型冠状病毒肺炎疫情最新情况,2021年4月29日,黄冈市人民政府
1589,科学网,截至4月28日24时新型冠状病毒肺炎疫情最新情况,2021年4月29日,科学网
1590,中国网,警惕!四种季节性冠状病毒会发生再感染,2020年9月16日,中国网
1591,安徽省人民政府网,安徽省人民政府办公厅关于印发应对新型冠状病毒肺炎疫情若干政策措...,2021年4月28日,安徽省人民政府网
1592,科学网,截至4月27日24时新型冠状病毒肺炎疫情最新情况,2021年4月28日,科学网
1593,本地宝,四川4月24日无新增新型冠状病毒肺炎确诊病例,2021年4月25日,本地宝
1594,中金在线,英国再感染研究将刻意让康复者再次接触冠状病毒 政府将着手调查77...,2021年4月19日,中金在线
1595,中国民用航空网,新型冠状病毒肺炎疫情防控 – 民用航空网,2021年4月19日,中国民用航空网
1596,四海网,冠状病毒:和冠状病毒相关的精彩内容推荐_四海网,2021年4月18日,四海网
1597,头条前瞻,"新研究曝光!除新冠病毒外,去年英国还遭受另一种冠状病毒的袭击",2021年4月15日,头条前瞻
1598,中金网,冠状病毒_冠状病毒的最新相关消息_中金网,2021年4月15日,中金网
1599,青岛新闻网,4月11日山东省新型冠状病毒肺炎疫情情况,2021年4月12日,青岛新闻网
1600,曲阜网,截至4月9日24时新型冠状病毒肺炎疫情最新情况,2021年4月10日,曲阜网
1601,鄂尔多斯市人民政府,鄂尔多斯市新型冠状病毒感染的肺炎疫情防控指挥部通告,2021年4月3日,鄂尔多斯市人民政府
1602,西部庭州,王国和、金之镇调研检查自治州新型冠状病毒疫苗大规模免费接种工作,2021/5/5,西部庭州
1603,成都头条,"四川新增新型冠状病毒肺炎确诊病例3例,为境外输入",2021年3月30日,成都头条
1604,江西省人民政府,2021年3月25日江西省新型冠状病毒肺炎疫情情况,2021年3月29日,江西省人民政府
1605,www.yngn.gov.cn,广南县应对新型冠状病毒感染肺炎疫情工作领导小组指挥部办公室关于...,2021年3月27日,www.yngn.gov.cn
1606,新浪江西站,2021年3月26日江西省新型冠状病毒肺炎疫情情况通报,2021年3月27日,新浪江西站
1607,新民网,上海自主研发的mRNA新型冠状病毒肺炎疫苗I期临床试验正式启动,2021年3月25日,新民网
1608,云掌财经,新型冠状病毒_新型冠状病毒热门新闻资讯_云掌财经,2021年3月24日,云掌财经
1609,国务院新闻办公室,天津举行第158场新型冠状病毒肺炎疫情防控工作系列新闻发布会,2021年3月22日,国务院新闻办公室
1610,南方财富网,2021年新型冠状病毒概念股有哪些?新型冠状病毒概念龙头股一览,2021年3月18日,南方财富网
1611,观察者网,"中科院研发重组新型冠状病毒疫苗(CHO细胞)获准紧急使用,系国内...",2021年3月16日,观察者网
1612,新浪网,广东发现新型冠状病毒B.1.525尼日利亚突变株,2021年3月14日,新浪网
1613,中国甘肃网,截至3月8日24时新型冠状病毒肺炎疫情最新情况,2021年3月9日,中国甘肃网
1614,张家口新闻网,截至3月7日24时新型冠状病毒肺炎疫情最新情况,2021年3月8日,张家口新闻网
1615,青岛新闻网,2021年3月7日山东省新型冠状病毒肺炎疫情情况,2021年3月8日,青岛新闻网
1616,张家口新闻网,截至3月5日24时新型冠状病毒肺炎疫情最新情况,2021年3月6日,张家口新闻网
1617,每经网,新型冠状病毒很可能来自野味!记者调查:武汉多家餐厅曾售卖獾、刺...,2天前,每经网
1618,驱动之家,钟南山说无法根除新冠但可控制 冠状病毒本世纪已袭击人类3次,2021年3月3日,驱动之家
1619,荆楚网,新型冠状病毒感染的肺炎疫情湖北权威发布关于湖北省发生的新型冠状...,2021年2月27日,荆楚网
1620,财新网,新型冠状病毒_相关新闻报道_财新网,2021年2月23日,财新网
1621,荆楚网,新型冠状病毒感染的肺炎疫情辟谣打谣新型冠状病毒感染的肺炎疫情...,2021年2月14日,荆楚网
1622,荆楚网,新型冠状病毒感染的肺炎疫情辟谣打谣新型冠状病毒感染的肺炎疫情...,2021年2月14日,荆楚网
1623,国务院新闻办公室,黑龙江举行新型冠状病毒肺炎疫情防控工作发布会(第七十七场),2021年2月9日,国务院新闻办公室
1624,包头市人民政府,包头市召开第五次新型冠状病毒感染的肺炎,2021年2月2日,包头市人民政府
1625,本地宝,苏州新型冠状病毒感染肺炎最新消息(更新中),2021年1月26日,本地宝
1626,本地宝,2021杭州新型冠状病毒最新消息(持续更新),2021年1月24日,本地宝
1627,浙江新闻,浙江省新型冠状病毒肺炎疫情情况 ,2021年1月23日,浙江新闻
1628,看看新闻网,河北新增18例本地新型冠状病毒肺炎确诊病例,2021年1月22日,看看新闻网
1629,中国常德,国务院应对新型冠状病毒感染肺炎疫情联防联控机制关于进一步做好当...,2021年1月18日,中国常德
1630,OFweek维科网,"冠状病毒,什么是冠状病毒?冠状病毒的最新报道",2021年1月13日,OFweek维科网
1631,OFweek维科网,"新型冠状病毒,什么是新型冠状病毒?新型冠状病毒的最新报道",2021年1月13日,OFweek维科网
1632,漳州市人民政府,漳州市新型冠状病毒肺炎疫情情况,2021年1月11日,漳州市人民政府
1633,浙江新闻,12月19日湖州市新型冠状病毒肺炎疫情通报 ,2020年12月19日,浙江新闻
1634,宜宾市人民政府,市委应对新型冠状病毒肺炎疫情领导小组关于调整市委应对新型冠状病...,2020年12月16日,宜宾市人民政府
1635,生物谷,首页 » 标签 :“新型冠状病毒”(共找到约191条相关新闻),2020年11月15日,生物谷
1636,生物谷,首页 » 标签 :“新型冠状病毒”(共找到约191条相关新闻),2020年11月15日,生物谷
1637,衡阳市党政门户网站,国务院应对新型冠状病毒肺炎疫情联防联控机制综合组关于印发新型...,2020年10月16日,衡阳市党政门户网站
1638,西安兵马俑在线,全球无一例感染国家名单 哪些国家没有感染新型冠状病毒,2020年10月10日,西安兵马俑在线
1639,头条前瞻,"自然免疫不可靠?科学家发现冠状病毒家族二次感染是常态,新冠或具...",2020年10月9日,头条前瞻
1640,桂林生活网,8种冠状病毒中的7种都在这里!,2020年9月2日,桂林生活网
1641,每经网,冠状病毒疫苗免疫力一般能维持多久?我国疫情最大风险来自哪里?...,1天前,每经网
1642,新浪财经,冠状病毒病时代的货币?,2020年8月20日,新浪财经
