order_id,user_name,content,,
727,健康一线,国家卫健委:5月11日新增新冠肺炎确诊病例16例 均为境外输入病例,4小时前,健康一线
728,杭州网,5月11日浙江新冠肺炎新增确诊病例1例 新增无症状感染者2例,4小时前,杭州网
729,大西北网,中国政府紧急援助老挝抗击新冠肺炎物资,4小时前,大西北网
730,北部湾在线,中国政府紧急援助老挝抗击新冠肺炎物资,4小时前,北部湾在线
731,北部湾在线,中国政府紧急援助老挝抗击新冠肺炎物资,4小时前,北部湾在线
732,东南网,美国新冠肺炎确诊3276万 过去一周日均新增确诊3.88万例,4小时前,东南网
733,河南一百度,接种新冠疫苗后 巴西警员因新冠肺炎请病假人数下降约82%,4小时前,河南一百度
734,新浪,5月12日安徽省报告新冠肺炎疫情情况,4小时前,新浪
735,新浪,5月11日辽宁省无新增新冠肺炎确诊病例,4小时前,新浪
736,民主与法制网,国家卫健委:5月11日新增新冠肺炎确诊病例16例 均为境外输入病例,4小时前,民主与法制网
737,界面新闻,江苏5月11日新增境外输入新冠肺炎确诊病例1例,4小时前,界面新闻
738,齐鲁网,国家卫健委:11日新增新冠肺炎确诊病例16例 均为境外输入病例,4小时前,齐鲁网
739,21CN,国家卫健委:11日新增新冠肺炎确诊病例16例 均为境外输入病例,4小时前,21CN
740,扬州网,5月11日江苏新增境外输入新冠肺炎确诊病例1例,4小时前,扬州网
741,现代快报网,5月11日江苏新增境外输入新冠肺炎确诊病例1例,4小时前,现代快报网
742,长城网,"11日河北无新增新冠肺炎确诊病例,无新增无症状感染者",4小时前,长城网
743,河南一百度,5月11日河南省无新增新冠肺炎确诊病例、 疑似病例,4小时前,河南一百度
744,河南日报网,5月11日河南省无新增新冠肺炎确诊病例、 疑似病例,4小时前,河南日报网
745,川南在线,"四川新增新冠肺炎确诊病例1例,为境外输入",4小时前,川南在线
746,中国江苏网,5月11日江苏新增境外输入新冠肺炎确诊病例1例,4小时前,中国江苏网
747,中安在线,蚌埠累计接种新冠肺炎病毒疫苗26.117万剂,5小时前,中安在线
748,贵州网络广播电视台,5月11日贵州省新冠肺炎疫情信息发布,5小时前,贵州网络广播电视台
749,东南网,中国政府紧急援助老挝抗击新冠肺炎物资,5小时前,东南网
750,济宁新闻网,疫情通报|济宁市2021年5月11日0时至24时新冠肺炎疫情情况,5小时前,济宁新闻网
751,安徽省人民政府网,5月12日安徽省报告新冠肺炎疫情情况,5小时前,安徽省人民政府网
752,长城网,美国新冠肺炎确诊3276万例 一周日均新增3.88万例,5小时前,长城网
753,长城网,西班牙一名已接种辉瑞疫苗的妇女因新冠肺炎死亡,5小时前,长城网
754,洛阳新闻网,5月11日河南无新增新冠肺炎确诊病例、疑似病例,5小时前,洛阳新闻网
755,大河网,最新通报 | 5月11日河南省无新增新冠肺炎确诊病例、 疑似病例,5小时前,大河网
756,北青网,巴西新冠肺炎确诊病例超1528万例,5小时前,北青网
757,大洋网,美国新冠肺炎确诊3276万例 一周日均新增3.88万例,5小时前,大洋网
758,新民网,"昨天上海无新增本地新冠肺炎确诊病例,新增3例境外输入病例",6小时前,新民网
759,北青网,世卫组织:全球新冠肺炎确诊病例超过1.586亿例,6小时前,北青网
760,南海网,美国新冠肺炎确诊3276万例 一周日均新增3.88万例,6小时前,南海网
761,中国小康网,国家卫健委:10日新增新冠肺炎确诊病例14例 均为境外输入病例,22小时前,中国小康网
762,温州网,浙江第七十二场新冠肺炎疫情防控工作新闻发布会召开,23小时前,温州网
763,荆楚网,2021年5月10日湖北省新冠肺炎疫情情况,2021年5月11日,荆楚网
764,新浪财经,世卫组织:全球新冠肺炎确诊病例超过1.579亿例,2021年5月11日,新浪财经
765,观察者网,新冠肺炎抗疫战-观察者网,2021年5月10日,观察者网
766,大公网,印度出现罕见病菌 致8名新冠肺炎幸存者死亡,2021年5月10日,大公网
767,本地宝,南京新冠肺炎疫情各区风险等级名单(实时更新),2021年5月10日,本地宝
768,新民网,"美国新冠肺炎确诊3270万,死亡超58.1万",2021年5月10日,新民网
769,中国政府网,国家卫生健康委部署新冠肺炎疫情防控工作,2021年5月9日,中国政府网
770,观察者网,新冠肺炎抗疫战-观察者网,2021年5月10日,观察者网
771,新民网,"昨天上海无新增本地新冠肺炎确诊病例,新增6例境外输入病例",2021年5月9日,新民网
772,新浪,一年多了 750具新冠肺炎逝者遗体还在纽约的冷藏车里,2021年5月8日,新浪
773,新浪,国家卫健委:昨日新增新冠肺炎确诊病例7例 均为境外输入,2021年5月8日,新浪
774,新浪网,"邻国纷纷“爆炸”,瑞丽死命扛住",2021年5月8日,新浪网
775,新浪上海,2021上海民生访谈 上海新冠肺炎患者救治情况怎么样?,2021年5月7日,新浪上海
776,多彩贵州网,疫情通报|5月5日贵州省新冠肺炎疫情信息发布,2021年5月6日,多彩贵州网
777,本地宝,新冠肺炎国内高风险地区名单最新(实时更新),2021年5月6日,本地宝
778,十堰秦楚网,"2021年5月5日,十堰市新冠肺炎疫情情况公布",2021年5月6日,十堰秦楚网
779,广西壮族自治区政府,广西进一步加强边境口岸输入性新冠肺炎疫情防控工作,2021年5月6日,广西壮族自治区政府
780,十堰秦楚网,"2021年5月4日,十堰市新冠肺炎疫情情况公布",2021年5月5日,十堰秦楚网
781,华尔街见闻,印度累计新冠肺炎确诊病例超2000万例 累计死亡超22万例,2021年5月4日,华尔街见闻
782,wsjkw.sh.gov.cn,"上海2021年5月2日,无新增本地新冠肺炎确诊病例 新增境外输入5例 ...",2021年5月3日,wsjkw.sh.gov.cn
783,wsjkw.sh.gov.cn,"上海2021年5月1日,无新增本地新冠肺炎确诊病例 新增境外输入4例 ...",2021年5月2日,wsjkw.sh.gov.cn
784,镇江市人民政府,镇江市抗击新冠肺炎疫情表彰大会隆重举行,2021年4月30日,镇江市人民政府
785,镇江市人民政府,镇江市抗击新冠肺炎疫情表彰大会隆重举行,2021年4月30日,镇江市人民政府
786,科学网,北工大“新冠肺炎治疗药物”研发项目签约,2021年4月29日,科学网
787,广州市人民政府,4月28日广州市新冠肺炎疫情情况,2021年4月29日,广州市人民政府
788,甘肃省人民政府,——甘肃抗击新冠肺炎疫情工作综述,2021年4月26日,甘肃省人民政府
789,华龙网,重庆昨日无新增新冠肺炎确诊病例,2021年4月26日,华龙网
790,新浪网,“新德里每4分钟就有一人死于新冠肺炎”!,2021年4月25日,新浪网
791,海南新闻,海南省关于巴拿马籍货轮输入新冠肺炎疫情进展通报,2021年4月21日,海南新闻
792,深圳新闻网,91位捐献遗体新冠肺炎患者:他们的名字永远留在武汉,2021年4月21日,深圳新闻网
793,新浪网,最新!运城市新冠肺炎疫情防控指挥部通告,2021年4月20日,新浪网
794,中国台湾网,台湾新增2例新冠肺炎确诊病例 感染源不明,2021年4月20日,中国台湾网
795,新浪,张文宏在深圳谈新冠肺炎 人类通过科学力量可战胜疫情,2021年4月19日,新浪
796,黄河新闻网,新冠肺炎疫情举报专区——黄河新闻网,2021年4月19日,黄河新闻网
797,海南新闻,海南报告4例境外输入性新冠肺炎确诊病例,2021年4月18日,海南新闻
798,新浪,4月17日江苏无新增新冠肺炎确诊病例,2021年4月18日,新浪
799,青岛新闻网,"无新增!4月16日,山东新冠肺炎疫情情况公布",2021年4月17日,青岛新闻网
800,海峡网,日本新冠肺炎感染人数不断增加:有哪些艺人明星感染新冠,2021年4月15日,海峡网
801,西陆军事,"美军投毒实锤?新冠来源调查炸锅,中国发声",2021年4月15日,西陆军事
802,钦州市政府门户网站,自治区新冠肺炎疫情防控指挥部发布《通知》,2021年4月14日,钦州市政府门户网站
803,呼和浩特市政府信息网,呼和浩特市新冠肺炎疫情防控指挥部公告,2021年4月12日,呼和浩特市政府信息网
804,澎湃,"台湾新增1例新冠肺炎死亡病例,为一名60多岁男性",2021年4月11日,澎湃
805,青岛新闻网,云南新增新冠肺炎本土确诊病例8例,2021年4月9日,青岛新闻网
806,江海明珠网,4月7日江苏新增境外输入新冠肺炎确诊病例1例,2021年4月8日,江海明珠网
807,四川省人民政府,我省印发2021年新冠肺炎疫情防控工作指南(第三版)固定场所接种与...,2021年4月2日,四川省人民政府
808,新浪网,《四川省2021年新冠肺炎疫情防控工作指南(第三版)》发布,2021年4月2日,新浪网
809,四川在线,《四川省2021年新冠肺炎疫情防控工作指南(第三版)》发布,2021年4月1日,四川在线
810,四川省人民政府,关于印发四川省2021年新冠肺炎疫情防控工作指南(第三版)的通知,2021年4月1日,四川省人民政府
811,中国台湾网,台湾新增6例境外输入新冠肺炎确诊病例 累计1036例,2021年4月1日,中国台湾网
812,风闻社区,张伯礼:中医药在治疗石家庄新冠肺炎患者中发挥积极作用,2021年5月5日,风闻社区
813,本地宝,2021浙江新冠肺炎疫情最新消息(每日更新),2021年4月16日,本地宝
814,华商网,西安鄠邑区居民可免费接种新冠肺炎疫苗了 门诊名单公布,2021年3月26日,华商网
815,头条前瞻,假的?“新冠肺炎2019年就出现在意大利”研究遭质疑:发表得太快,2021年3月25日,头条前瞻
816,安康市人民政府,市政府专题部署新冠肺炎疫情防控重点工作,2021年3月24日,安康市人民政府
817,本地宝,2021杭州新冠肺炎疫苗最新消息(持续更新…),2021年3月22日,本地宝
818,好大夫在线,国内获批的5款新冠疫苗各有何特点?,2021年3月21日,好大夫在线
819,健康界,"全国新增12例新冠肺炎确诊病例,均为境外输入",2021年3月21日,健康界
820,新浪,注意!一新冠肺炎确诊病例在郑州乘坐高铁,2021年3月12日,新浪
821,北京市人民政府,2021年将是新冠肺炎疫情转折点,2021年3月10日,北京市人民政府
822,重庆市人民政府,2021年3月7日重庆市新冠肺炎疫情情况,2021年3月7日,重庆市人民政府
823,健康界,张伯礼代表: 为新冠肺炎康复治疗提供中国方案,2021年3月4日,健康界
824,北京市人民政府,北京新冠肺炎疫情防控工作领导小组第一〇四次会议暨首都严格进京...,2021年3月2日,北京市人民政府
825,十堰市政府网,2021年2月27日十堰市新冠肺炎疫情情况,2021年2月28日,十堰市政府网
826,驱动之家,2020年度中国科学十大进展发布:应对新冠肺炎疫情取得突出进展第一,2021年2月27日,驱动之家
827,华图教育,『美国新冠肺炎超2839万例』全球新冠肺炎数据实时统计系统,2021年2月26日,华图教育
828,浙江新闻,早读社美国新冠肺炎死亡病例超过50万 ,2021年2月23日,浙江新闻
829,中国法院网,国家卫健委:16日新增新冠肺炎确诊病例7例 均为境外输入病例,2021年2月17日,中国法院网
830,十堰市政府网,2021年2月14日十堰市新冠肺炎疫情情况,2021年2月15日,十堰市政府网
831,湖北省人民政府,2021年全省新冠肺炎疫情防控线上演练纪实,2021年2月10日,湖北省人民政府
832,华龙网,2月7日0—24时 重庆本地无新增新冠肺炎确诊病例报告,2021年2月8日,华龙网
833,华商网,吉林省新增新冠肺炎确诊病例1例 无症状感染者1例,2021年2月6日,华商网
834,东北网,黑龙江省新冠肺炎救治中心47人出院,2021年2月3日,东北网
835,西陆军事,"新冠肺炎真名“美国肺炎”,事实终于清楚了!",2021年1月29日,西陆军事
836,石家庄市人民政府,我市举行新冠肺炎疫情防控第24场新闻发布会,2021年1月29日,石家庄市人民政府
837,贵港市人民政府网,贵港市新冠肺炎疫情防控工作领导小组指挥部令,2021年1月29日,贵港市人民政府网
838,深圳政府在线,2021年1月29日深圳市新冠肺炎疫情情况,2021年1月29日,深圳政府在线
839,本地宝,四川2021年新冠肺炎疫情防控工作指南第二版发布(附全文),2021年1月28日,本地宝
840,内蒙古新闻网,呼和浩特市新冠肺炎疫情防控指挥部公告(2021年第9号),2021年1月28日,内蒙古新闻网
841,包头市人民政府,包头市新冠肺炎防控工作指挥部通告,2021年1月28日,包头市人民政府
842,新浪网,四川省2021年新冠肺炎疫情防控工作指南(第二版),2021年1月28日,新浪网
843,新浪河北,河北7例新增新冠肺炎确诊病例详情公布 年龄最小1岁,2021年1月27日,新浪河北
844,重庆市人民政府,关于进一步做好当前新冠肺炎疫情防控工作的通知,2021年1月26日,重庆市人民政府
845,中关村在线,全球新冠肺炎病例已超一亿 或要传播很久,2021年1月26日,中关村在线
846,中金在线,全球新冠肺炎病例已超一亿 变种病毒耐药性担忧刺激市场风云突变,2021年1月26日,中金在线
847,呼和浩特市政府信息网,呼和浩特市新冠肺炎疫情防控指挥部公告,2021年1月25日,呼和浩特市政府信息网
848,内蒙古新闻网,呼和浩特市新冠肺炎疫情防控指挥部公告(2021年第8号),2021年1月24日,内蒙古新闻网
849,本地宝,冬春季农村地区新冠肺炎疫情防控工作方案(全文),2021年1月21日,本地宝
850,中国政府网,《冬春季农村地区新冠肺炎疫情防控工作方案》重点问题答问,2021年1月21日,中国政府网
851,本地宝,2021年冬春季农村地区新冠肺炎疫情防控工作方案原文(完整版),2021年1月20日,本地宝
852,国务院新闻办公室,河北举行新冠肺炎疫情防控工作新闻发布会(第七场),2021年1月19日,国务院新闻办公室
853,洛阳新闻网,扩散!洛阳市新冠肺炎疫情防控指挥部最新通告,2021年1月14日,洛阳新闻网
854,国务院新闻办公室,广西举行新冠肺炎疫情防控工作新闻发布会,2021年1月13日,国务院新闻办公室
855,本地宝,新冠肺炎灭活疫苗价格大概多少钱一针?,2021年1月12日,本地宝
856,安徽网,黑龙江新增新冠肺炎确诊病例1例、无症状感染者36例,2021年1月12日,安徽网
857,本地宝,免费国产新冠肺炎疫苗有必要打吗?,2021年1月4日,本地宝
858,风闻社区,新冠肺炎疫苗安全吗?,2020年12月31日,风闻社区
859,中金在线,美国新冠肺炎超1967万例、金价正逼近千九关口 5个理由告诉你为何要...,2020年12月31日,中金在线
860,扬子晚报网,新冠肺炎疫苗终于来了 打疫苗之前请先打消这些疑虑,2020年12月29日,扬子晚报网
861,中国台州网,新冠肺炎疫苗终于来了 打疫苗之前请先打消这些疑虑,2020年12月29日,中国台州网
862,长江网,"新冠肺炎疫苗终于来了,打疫苗之前请先打消这些疑虑",2020年12月29日,长江网
863,澎湃,新冠肺炎疫苗终于来了!打疫苗之前请先打消这些疑虑,2020年12月29日,澎湃
864,本地宝,沈阳新冠肺炎疫情最新消息(更新至2021年1月17日),2020年12月25日,本地宝
865,中国宁波网,宁波市新冠肺炎疫情防控工作新闻发布稿源:,2020年12月24日,中国宁波网
866,中国宁波网,宁波市新冠肺炎疫情防控工作新闻发布,2020年12月24日,中国宁波网
867,孝感市人民政府,孝感市新冠肺炎防控指挥部召开第20场新闻发布会,2020年12月18日,孝感市人民政府
868,OFweek维科网,"新冠性肺炎,什么是新冠性肺炎?新冠性肺炎的最新报道",2020年12月17日,OFweek维科网
869,安康市人民政府,安康市新冠肺炎联防联控工作指挥部办公室新冠肺炎疫情形势及个人防...,2020年12月15日,安康市人民政府
870,新浪网,唐山 滦南有人确诊新冠肺炎?官方最新消息来了,2020年11月23日,新浪网
871,TechWeb,全球新冠肺炎确诊超过4600万 钟南山:中国爆发二次疫情可能性很低,2020年11月1日,TechWeb
872,本地宝,2020年8月7日广东省新冠肺炎最新消息(附疫情地图),2020年10月30日,本地宝
873,包头市人民政府,包头市新冠肺炎防控工作指挥部通告,2020年10月27日,包头市人民政府
874,完美天空,新冠肺炎病毒疫苗怎么接种,2020年10月23日,完美天空
875,新浪,佩莱格里尼感染新冠肺炎 曾是奥运女子200自冠军,2020年10月16日,新浪
876,求是网,全国抗击新冠肺炎疫情先进个人童朝晖,2020年10月16日,求是网
877,求是网,在全国抗击新冠肺炎疫情表彰大会上的讲话,2020年10月15日,求是网
878,中国科学院,促成首例新冠肺炎病人遗体解剖,2020年10月14日,中国科学院
879,黑龙江省人民政府,黑龙江省抗击新冠肺炎疫情拟表彰对象公示,2020年10月10日,黑龙江省人民政府
880,本地宝,新冠肺炎疫苗最新消息(研发进展+何时上市+价格+有效性),2020年9月27日,本地宝
881,本地宝,新冠肺炎灭活疫苗是什么意思?,2020年9月27日,本地宝
882,股城网,武汉多少人死于新冠肺炎 真实死亡数据修订如下,2020年9月26日,股城网
883,新浪网,新冠肺炎疫情:一场全球心理“海啸”,2020年9月17日,新浪网
884,股城网,无医保新冠肺炎治疗自费吗 国家不再承担费用是谣言,2020年9月15日,股城网
885,广东省人民政府,广东省新冠肺炎防控指挥办疫情防控组关于印发《广东省大型群众性...,2020年9月14日,广东省人民政府
886,广东省人民政府,广东省新冠肺炎防控指挥办疫情防控组关于印发《广东省大型群众性...,2020年9月14日,广东省人民政府
887,新浪网,全国抗击新冠肺炎疫情先进集体名单,2020年9月9日,新浪网
888,巴中市人民政府,在全国抗击新冠肺炎疫情表彰大会上的讲话(2020年9月8日)习近平,2020年9月9日,巴中市人民政府
889,中国军网,中国抗击新冠肺炎疫情全纪实,2020年9月7日,中国军网
890,国防部,关于表彰全国抗击新冠肺炎疫情先进个人和先进集体的决定,2020年9月8日,国防部
891,中国文明网,同舟共济战“疫”记——中国抗击新冠肺炎疫情全纪实,2020年9月7日,中国文明网
892,国防部,中国抗击新冠肺炎疫情伟大斗争启示录,2020年9月7日,国防部
893,中国军网,中国抗击新冠肺炎疫情全纪实,2020年9月7日,中国军网
894,头条前瞻,全球首例!一名新冠肺炎康复者4个多月后二次感染 患者痊愈后并非终...,2020年8月25日,头条前瞻
895,中国教育部,教育部应对新冠肺炎疫情工作领导小组办公室,2020年8月20日,中国教育部
896,股城网,新冠肺炎医保报销吗 患者需要自己承担费用?,2020年8月19日,股城网
897,中国教育部,科学指导学校疫情防控工作 有序推进秋季学期复学复课,2020年8月15日,中国教育部
898,每经网,美国研究发现98种新冠肺炎潜在症状:有患者已失去了约75%的头发,2021/5/2,每经网
899,中国阜新,中国发布新冠肺炎疫情信息、推进疫情防控国际合作纪事,2021/5/6,中国阜新
900,四川在线,"新冠肺炎病死率究竟是多少? 研究人员:全球平均0.68%,但一切取决...",2020年7月23日,四川在线
901,电子发烧友,新冠肺炎疫情在肆虐全球时也无意的推动了物联网等新技术的发展,2020年7月22日,电子发烧友
902,大众网,纳瓦罗关于新冠肺炎疫情的涉华谎言与事实真相,2020年7月22日,大众网
903,本地宝,2020年7月15日深圳新冠肺炎疫情最新消息,2020年7月15日,本地宝
904,东方网,新冠肺炎临床四种类型如何划分? 专家答疑,2020年7月5日,东方网
905,深圳政府在线,2020年6月30日深圳市新冠肺炎疫情情况,2020年6月30日,深圳政府在线
906,海外网,全球新冠肺炎确诊病例超1000万例 外媒:大流行已进入新阶段,2020年6月28日,海外网
907,长江网,2020年6月23日湖北省新冠肺炎疫情情况,2020年6月24日,长江网
908,股城网,新冠肺炎治疗费用一位多少钱?,2020年6月19日,股城网
909,三亚市人民政府网,三亚市抗击新冠肺炎疫情先进集体、先进个人的公示,2020年6月17日,三亚市人民政府网
910,中国文明网,新冠肺炎疫情外 警惕一场“谣言流行病”,2020年6月10日,中国文明网
911,股城网,新冠肺炎治疗费用是自费还是免费?,2020年6月10日,股城网
912,一财网,《抗击新冠肺炎疫情的中国行动》白皮书(全文),2020年6月7日,一财网
913,人民网,"进一步做好新冠肺炎疫情常态化防控,福建这么做!",2020年5月16日,人民网
914,中国经济网,"践行人类命运共同体理念,抗击新冠肺炎疫情",2020年5月15日,中国经济网
915,光明网,法国新冠肺炎患者首例出现时间再次前推,2020年5月12日,光明网
916,光明网,美国关于新冠肺炎疫情的涉华谎言与事实真相,2020年5月9日,光明网
917,人民网,美国关于新冠肺炎疫情的涉华谎言与事实真相,2020年5月10日,人民网
918,光明网,美国关于新冠肺炎疫情的涉华谎言与事实真相,2020年5月10日,光明网
919,中国经济网,美国关于新冠肺炎疫情的涉华谎言与事实真相,2020年5月10日,中国经济网
920,环球网,美国关于新冠肺炎疫情的涉华谎言与事实真相,2020年5月9日,环球网
921,光明网,美国关于新冠肺炎疫情的涉华谎言与事实真相,2020年5月9日,光明网
922,人民网,美国新冠肺炎确诊超125万人 死亡超7.5万人,2020年5月8日,人民网
923,人民网,人民日报人民时评:防治新冠肺炎见证中医实力,2020年4月30日,人民网
924,人民网,31省份新增新冠肺炎确诊病例11例 其中7例为本土病例,2020年4月21日,人民网
925,金投网,新冠肺炎治疗不免费了?,2020年4月17日,金投网
926,环球网,"台湾新增2例新冠肺炎确诊病例,累计395例",2020年4月15日,环球网
927,人民网,最高检发布6个涉新冠肺炎疫情严重暴力犯罪典型案例,2020年4月9日,人民网
928,中国网,北京5日新增报告境外输入新冠肺炎确诊病例1例,2020年4月6日,中国网
929,网易科技,闻玉梅院士:新冠肺炎不会长期流行 它打不倒我们,2020年4月5日,网易科技
930,中国经济网,众志成城——2020中国抗击新冠肺炎疫情纪实,2020年4月1日,中国经济网
931,光明数字报,新冠肺炎疫情带给医学的十点思考,2020年4月1日,光明数字报
932,阳光高考,教育部关于应对新冠肺炎疫情 稳妥做好2020年全国普通高校招生工作...,2020年3月31日,阳光高考
933,人民网河南频道,河南郏县发现两例新冠肺炎阳性检测者,2020年3月29日,人民网河南频道
934,光明网,新冠肺炎疫情会“反扑”吗?如何避免?,2020年3月29日,光明网
935,正义网,中国抗击新冠肺炎疫情的世界意义,2020年3月28日,正义网
936,人民网,美国新冠肺炎疫情日益恶化,2020年3月27日,人民网
937,人民网,武汉市政府不再对新冠肺炎病人免费治疗?谣言!,2020年3月25日,人民网
938,一点资讯,"新冠肺炎疫情下,中美舆论战的正确姿态",2020年3月24日,一点资讯
939,环球网,新冠肺炎致死率为何差异大,2020年3月23日,环球网
940,人民网,新冠肺炎疫情给中国未来带来的五大变化,2020年3月18日,人民网
941,中青在线,"就新冠肺炎疫情,习近平致电这四国领导人",2020年3月19日,中青在线
942,光明网,新冠肺炎疫情给中国未来带来的五大变化,2020年3月17日,光明网
943,人民网,美国新冠肺炎疫情应对措施升级,2020年3月16日,人民网
944,新华网重庆频道,特写:重庆最后一例新冠肺炎在院确诊患者出院,2020年3月15日,新华网重庆频道
945,思客,"新冠肺炎疫情“大流行”,意味着什么?| 思客问答",2020年3月13日,思客
946,光明日报,"新冠肺炎病死率意大利最高,如何看待",2020年3月13日,光明日报
947,中国网,破解武汉新冠肺炎疫情收治危局[组图],2020年3月12日,中国网
948,人民网,习近平:坚决克服新冠肺炎疫情影响 坚决夺取脱贫攻坚战全面胜利,2020年3月9日,人民网
949,光明日报,"新冠肺炎病死率意大利最高,如何看待",2020年3月13日,光明日报
950,中国新闻网,抗击新冠肺炎 · 河北战“疫”要闻汇丨2020-03-01,2020年3月1日,中国新闻网
951,人民网,习近平:坚决克服新冠肺炎疫情影响 坚决夺取脱贫攻坚战全面胜利,2020年3月9日,人民网
952,光明网,新冠肺炎疫情给中国未来带来的五大变化,2020年3月17日,光明网
953,中国新闻网,新冠肺炎疫情防控是中国制度优势的最好印证,2020年3月3日,中国新闻网
954,思客,"新冠肺炎疫情“大流行”,意味着什么?| 思客问答",2020年3月13日,思客
955,新华网重庆频道,特写:重庆最后一例新冠肺炎在院确诊患者出院,2020年3月15日,新华网重庆频道
956,新华网江苏频道,南京新冠肺炎确诊患者已治愈52例 最大97岁,2020年2月24日,新华网江苏频道
957,中国网,破解武汉新冠肺炎疫情收治危局[组图],2020年3月12日,中国网
958,人民网,美国新冠肺炎疫情应对措施升级,2020年3月16日,人民网
