order_id,user_name,content,,
1,搜狐,实际死亡或超90万!福奇承认美疫情被“严重低估”,28分钟前,搜狐
2,人民网,求真观察丨“疫情之下华商太难了”3人编造涉外疫情虚假信息获刑,1小时前,人民网
3,搜狐,印度疫情将加剧全球供应短缺,5小时前,搜狐
4,搜狐,中国为拉美疫情防控提供有力支持,7小时前,搜狐
5,搜狐,无惧印度疫情高烧难退 欧佩克继续看好今年原油需求复苏,15小时前,搜狐
6,网易,"赶上中国无望,疫情失控重创印度手机产业,供应链转移计划落空",1小时前,网易
7,腾讯,印度疫情失控!总理莫迪确定不会亲自出席G7高峰会,3小时前,腾讯
8,腾讯,受疫情影响 富士康印度工厂的iPhone 12产量降了一半,3小时前,腾讯
9,腾讯,"绝望又无奈,新冠疫情在没有医院甚至没有医生的印度农村肆虐",2小时前,腾讯
10,搜狐,【疫情速报】联合国希望世卫组织审查通过后使用俄产疫苗!,13小时前,搜狐
11,国际在线,马来西亚新冠疫情蔓延 基本传染数连续5天破1.1,2小时前,国际在线
12,央视网,疫情期间美国大企业高管薪资逆势上涨 “肮脏的秘密”引发舆论不满,2小时前,央视网
13,中国新闻网,阿根廷:生意难做 疫情严重影响中小企业,2小时前,中国新闻网
14,光明网,因疫情闭门至今不开 社区老年餐厅为何频频关停,2小时前,光明网
15,中国新闻网,印度官员:新德里疫情有所好转但仍不可松懈,4小时前,中国新闻网
16,新华网,截至5月11日24时新型冠状病毒肺炎疫情最新情况,5小时前,新华网
17,网易,"日本疫情反弹!死亡率超印度,印方表示已准备好参加东京奥运会",6小时前,网易
18,网易,"大阪钢巴受疫情影响,士气不足.日职 001:大阪钢巴vs广岛三箭",12小时前,网易
19,搜狐,【疫情最新】5月10日深圳新增2例输入无症状感染者!广东首次发现新...,15小时前,搜狐
20,腾讯,疫情都这样了莫迪还急着整修议会大楼!难道不该先建医院?,3小时前,腾讯
21,搜狐,房价、疫情、朝韩关系:任期仅剩一年的文在寅如何解决难题?,4小时前,搜狐
22,搜狐,李奇霖:消费去哪了?,15小时前,搜狐
23,腾讯,菲律宾因非洲猪瘟疫情进入全国灾难状态,16小时前,腾讯
24,腾讯,由于疫情严重 苹果在印度生产业务遭严重打击,16小时前,腾讯
25,凤凰网,"事关疫情防控,天津发布最新通知",18小时前,凤凰网
26,凤凰网,瑞丽疫情最新情况要点速览,2021年5月11日,凤凰网
27,搜狐,"疫情后入住率大幅下降,美国疗养院的转型期有多痛?",2021年5月10日,搜狐
28,搜狐,"《柳叶刀》:疫情危机肆虐之际,印度现在必须调整其应对措施",2021年5月10日,搜狐
29,环球网,"严峻疫情形势下,美防长仍将出席香格里拉对话会,国防部发言人这么...",2021年5月6日,环球网
30,人民网,节后疫情防控仍不可懈怠,2021年5月6日,人民网
31,参考消息网,"锐参考 | 疫情风暴眼中,我们和两个印度人聊了聊——",2021年5月6日,参考消息网
32,人民网,疫情反弹背后的“美国病”,2021年5月6日,人民网
33,凤凰网,疫情扩散!印度周边多国慌了!人口不到3000万的尼泊尔日增确诊超...,2021年5月6日,凤凰网
34,人民网,河北疫情防控--河北频道--人民网,2021年5月5日,人民网
35,凤凰网,"疫情暴发前后表现判若两人,莫迪遭批“把人民丢在身后”",2021年5月4日,凤凰网
36,央视网,"图解印度疫情:两剂疫苗接种率不到2%,孟买所在邦疫情最重",2021年5月4日,央视网
37,环球网,疫情告急!印度海军出动军舰从国外往回运氧气,2021年5月1日,环球网
38,央视网,"印度疫情风暴中的华人:身边人不断感染,想帮却帮不了",2021年5月1日,央视网
39,央视网,疫情期间“五一”假期如何安心出行?这份指南来“护航”,2021年5月1日,央视网
40,环球网,"印度疫情形势严重,印媒细数:莫迪仅4月举行新冠相关会议高达21次",2021年4月30日,环球网
41,中国网,印度疫情失控 在印的中国人还好吗?,2021年4月29日,中国网
42,央视网,"印度疫情迎来“至暗时刻”,在那里的中国人还好吗?",2021年4月29日,央视网
43,环球网,疫情下在印中企“太难了”,2021年4月29日,环球网
44,中国日报网,"【疫情下的各国众生缩影】印度疫情:为了病床、氧气和药物,患者家...",2021年4月28日,中国日报网
45,观点中国,"印度“疫情海啸”, 美国态度为何“戏剧性”转变?",2021年4月28日,观点中国
46,参考消息网,"印度专家:疫情失控,政府难辞其咎",2021年4月27日,参考消息网
47,光明网,疫情严重 印度网友指责美国 把“伪善”“无法信任”打在了公屏上,2021年4月27日,光明网
48,中国日报网,疫情严重 印度网友指责美国 把“伪善”“无法信任”打在了公屏上,2021年4月27日,中国日报网
49,国际在线,疫情严重 印度网友指责美国 把“伪善”“无法信任”打在了公屏上,2021年4月27日,国际在线
50,光明网,疫情再来怎么办?科学家开出终极药方——“同一健康”,2021年4月27日,光明网
51,网易号,印度疫情暴了!老人被儿女弃路边等死!,2021年4月27日,网易号
52,新华网,疫情再来怎么办?科学家开出终极药方——“同一健康”,2021年4月27日,新华网
53,中国网,印度预测本国疫情5月中旬达峰 届时日增确诊病例将高达50万例,2021年4月26日,中国网
54,新华网,"全球连线 | 印度疫情告急!连续日增超30万例,新德里实施封锁措施,...",2021年4月26日,新华网
55,中国网,印度疫情全面失控 3天超百万人确诊 年轻感染者占多数,2021年4月26日,中国网
56,凤凰网,"印度疫情悲惨一幕:找不到救护车,男子将父亲尸体绑车顶送去火葬场",2021年4月26日,凤凰网
57,新京报,张文宏谈印度疫情失控:更大的暴发还在后面,2021年4月26日,新京报
58,新京报,"“全面失控”,印度疫情出现五大新变化",2021年4月25日,新京报
59,网易号,"疫情以来最高!全球日增89万+;印度疫情恶化,日增33万+,场面太...",2021年4月24日,网易号
60,中华网,"印度疫情进入紧急状态,美国捅刀割断救命稻草!",2021年4月23日,中华网
61,腾讯,"疫情惹的祸?去年全球一半国家和地区人口长不动了,中国多地骤降三成",2021年4月15日,腾讯
62,人民网,"疫苗打了这么多,美国疫情近期为何还反弹",2021年4月13日,人民网
63,人民网,中国应对疫情的成绩有目共睹(国际论坛),2021年4月8日,人民网
64,央广网,疫情通报:高度疑似引起瑞丽疫情的病毒通过人或物从缅甸输入,2021年4月4日,央广网
65,新华网甘肃频道,疫情下的开放通道盘活术,2021年3月30日,新华网甘肃频道
66,光明数字报,"“抗击疫情,我们在一起”",2021年3月30日,光明数字报
67,环球网,香港疫情逐渐缓和 特区政府计划下月起调整防疫措施,2021年3月29日,环球网
68,网易财经,疫情的意外副作用:各国生育率暴跌,2021年3月24日,网易财经
69,人民网,北京制定疫情防控常态化措施 3月16日开始实施,2021年3月15日,人民网
70,光明数字报,疫情让我们处于极端相互依存的关系之中,2021年3月10日,光明数字报
71,光明网,疫情让我们处于极端相互依存的关系之中,2021年3月10日,光明网
72,中国网,疫情难阻创新步伐 中国国际专利申请量保持全球第一,2021年3月3日,中国网
73,腾讯,英国疫情趋缓即将解封会反复吗?英国留学2021年秋季能恢复正常吗?,2021年3月1日,腾讯
74,环球网,疫情封锁让英国人重回“乔治时代”,2021年2月26日,环球网
75,中华网,最新疫情相关新闻_图片_视频_网友讨论_头条_中华网,2021年2月25日,中华网
76,人民网,疫情下急诊科的故事,2021年2月9日,人民网
77,city.cri.cn,疫情后的国际合作与经济展望(一)世界疫情影响概述,2021年2月4日,city.cri.cn
78,中国新闻网,别让疫情防控“六不准”变形走样,2021年2月3日,中国新闻网
79,观点中国,"精准施策,把握疫情防控工作主动权",2021年2月2日,观点中国
80,中国新闻网,疫情后的经济复苏和发展从何处发力,2021年1月23日,中国新闻网
81,人民网,疫情防控措施不到位 泉州多家医疗机构被查处,2021年1月20日,人民网
82,中国网,疫情会大规模卷土重来吗?春节该怎么过?专家研判,2021年1月18日,中国网
83,人民网,疫情会大规模卷土重来吗?春节该怎么过?专家研判,2021年1月18日,人民网
84,央广网,北京疫情防控形势仍严峻复杂 社会面、农村及重点场所防控工作存在漏...,2021年1月15日,央广网
85,人民网,疫情防控 福州早部署早准备早行动,2021年1月13日,人民网
86,人民网,湖北多地发布2021年疫情防控第1号通告,2021年1月11日,人民网
87,网易新闻,疫情防控失职失责 北京顺义高丽营镇书记等5人被处理,2021年1月1日,网易新闻
88,人民网,"人民网评:疫情零星散发不必恐慌,但防控不能松劲",2020年12月21日,人民网
89,新华网,国社@四川|直击成都疫情防控最前线太平村,2020年12月10日,新华网
90,人民网,"疫情期间我们在一线,疫情补助没有我们",2020年12月7日,人民网
91,国际在线,疫情急剧恶化医疗资源紧缺 印度孟买方舱医院再次满员,2021年4月29日,国际在线
92,中华网,疫情相关新闻_图片_视频_网友讨论_头条_中华网,2020年10月8日,中华网
93,网易号,"疫情最新消息!美国确诊763万例、死亡21.4万,实际人数远超公开",2020年10月5日,网易号
94,人民网,"疫情之后,我们能做什么?",2020年9月28日,人民网
95,光明网,抗击疫情应坚持多边主义和全球正义,2020年9月25日,光明网
96,人民网,疫情带给人类什么启示?从4个层面领会习近平的论述,2020年9月23日,人民网
97,光明网,“疫情或是好事”?白宫就疫情频发奇怪论调……,2020年9月20日,光明网
98,人民网,疫情防控体现党的人民情怀与历史担当,2020年9月4日,人民网
99,光明网,疫情形势下上合组织命运共同体建设面临的挑战和机遇,2020年9月4日,光明网
100,中华网,“疫情后时代”的机遇与挑战,2020年8月10日,中华网
101,人民网,疫情下的电影节怎么办?上影节给出三个关键词,2020年8月4日,人民网
102,人民网,疫情时期图像档案展最火,2020年8月3日,人民网
103,光明网,重大疫情防控要补哪些短板,2020年7月30日,光明网
104,环球网,"疫情又传一地,增至4省7城市!国家卫健委主任带队赴大连",2020年7月26日,环球网
105,光明网,在抗击疫情中坚定文化自信,2020年7月24日,光明网
106,中国日报网,"疫情“打掩护”,美国这些暴力行为愈演愈烈",2020年7月15日,中国日报网
107,人民网,疫情以来第四次通话 习近平与普京传递了哪些重要信息?,2020年7月9日,人民网
108,网易号,疫情带来的大数据第二春,2020年7月2日,网易号
109,人民网,疫情防控是对我国治理体系和治理能力的一次大考,2020年7月1日,人民网
110,光明网,疫情升至“千万”级 合作抗疫是出路,2020年7月1日,光明网
111,人民网,疫情防控期间的“四全媒体”,2020年6月23日,人民网
112,环球网,"美媒:克制,是中国在这波疫情中的新尝试",2020年6月22日,环球网
113,人民网四川频道,疫情下的“宅社交”,2020年5月26日,人民网四川频道
114,人民网,后疫情时代的思考,2020年5月25日,人民网
115,人民网,疫情防控取得重大战略成果,2020年5月23日,人民网
116,中国行业研究网,印度疫情令全球手机销量增幅下降 富士康印度工厂iPhone产量减半,32分钟前,中国行业研究网
117,新浪,实际死亡或超90万!福奇承认美疫情被“严重低估”,33分钟前,新浪
118,news.ycwb.com,实际死亡或超90万!福奇承认美疫情被＂严重低估＂,35分钟前,news.ycwb.com
119,安青网,实际死亡或超90万!福奇承认美疫情被＂严重低估＂,35分钟前,安青网
120,温州网,实际死亡或超90万!福奇承认美疫情被＂严重低估＂,42分钟前,温州网
121,风闻社区,"疫情如何改变世界人口?最大影响可能是出生数字,而不是死亡数字",49分钟前,风闻社区
122,曲阜网,求真观察丨“疫情之下华商太难了”3人编造涉外疫情虚假信息获刑,55分钟前,曲阜网
123,特时代,截至5月11日24时新型冠状病毒肺炎疫情最新情况,57分钟前,特时代
124,云南网,人民网“求真”栏目求真观察丨“疫情之下华商太难了”3人编造涉外...,59分钟前,云南网
125,西部网,实际死亡或超90万!福奇承认美疫情被＂严重低估＂,1小时前,西部网
126,和讯股票,"台湾疫情警戒将升级,台湾加权指数日内暴跌8%",1小时前,和讯股票
127,生物谷,首页 » 标签 :“新冠疫情”(共找到约83条相关新闻),1小时前,生物谷
128,生物谷,首页 » 标签 :“新冠疫情”(共找到约83条相关新闻),1小时前,生物谷
129,生物谷,世卫组织:中国正享受有效控制新冠疫情后的益处,1小时前,生物谷
130,生物谷,世卫组织:中国正享受有效控制新冠疫情后的益处,1小时前,生物谷
131,中国小康网,截至5月11日24时新型冠状病毒肺炎疫情最新情况,1小时前,中国小康网
132,新浪财经,中国台湾地区疫情警戒或将升级至3级,1小时前,新浪财经
133,新浪,截至5月12日7时内蒙古自治区新冠肺炎疫情最新情况,1小时前,新浪
134,3DMGAME,这波印度疫情的大坑 把苹果和富士康陷进去了!,1小时前,3DMGAME
135,东北网,实际死亡或超90万!福奇承认美疫情被＂严重低估＂,1小时前,东北网
136,新华报业网,实际死亡或超90万!福奇承认美疫情被＂严重低估＂,1小时前,新华报业网
137,千龙网,实际死亡或超90万!福奇承认美疫情被＂严重低估＂,1小时前,千龙网
138,金融界,鲁泰A:目前印度疫情对公司订单影响暂未显现,1小时前,金融界
139,和讯财经新闻,"台湾疫情警戒将升级,台湾加权指数日内暴跌8%",1小时前,和讯财经新闻
140,视界网,实际死亡或超90万!福奇承认美疫情被＂严重低估＂,1小时前,视界网
141,中国江苏网,实际死亡或超90万!福奇承认美疫情被＂严重低估＂,1小时前,中国江苏网
142,鲁网,实际死亡或超90万!福奇承认美疫情被＂严重低估＂,2小时前,鲁网
143,金投网,尼泊尔疫情最新消息 单日新增确诊连续7天超8000例,2小时前,金投网
144,深圳新闻网,实际死亡或超90万!福奇承认美疫情被＂严重低估＂,2小时前,深圳新闻网
145,深圳新闻网,实际死亡或超90万!福奇承认美疫情被＂严重低估＂,2小时前,深圳新闻网
146,曲阜网,因疫情闭门至今不开社区老年餐厅为何频频关停,2小时前,曲阜网
147,南方网,"【地评线】南方网评:从汶川地震到新冠疫情,生命至上闪耀光芒",2小时前,南方网
148,中国化工网,印度疫情将加剧全球供应短缺,2小时前,中国化工网
149,新浪财经,疫情期间美国大企业高管薪资逆势上涨 “肮脏的秘密”引发舆论不满,2小时前,新浪财经
150,金投网,API数据喜忧参半 疫情拖累油价还需更多提振-第3页,3小时前,金投网
151,金投网,API数据喜忧参半 疫情拖累油价还需更多提振-第4页,3小时前,金投网
152,华夏经纬,台湾疫情扩大陈时中脱口一句话 名医叹:外行话,3小时前,华夏经纬
153,中国经济网,因疫情闭门至今不开 北京社区老年餐厅为何频关停,4小时前,中国经济网
154,中国政府网,截至5月11日24时新型冠状病毒肺炎疫情最新情况,4小时前,中国政府网
155,丽水网,疫情常态化防控-新闻中心-丽水网,4小时前,丽水网
156,证券之星,无惧印度疫情高烧难退 欧佩克继续看好今年原油需求复苏,5小时前,证券之星
157,黑龙江省人民政府,最新疫情通报,5小时前,黑龙江省人民政府
158,和讯财经新闻,"印度疫情日益恶化,对于中国意味着什么?",5小时前,和讯财经新闻
159,中国经济网,印度疫情将加剧全球供应短缺,6小时前,中国经济网
160,台海网,"美国参议员桑德斯:“疫情期间,美国富豪变得越来越富有”",6小时前,台海网
161,台海网,印度疫情失控的蝴蝶效应:华尔街金融巨头后台将崩溃?,6小时前,台海网
162,汽车之家,疫情恶化 印度汽车销量或2年后才能恢复,7小时前,汽车之家
163,中国经济网,中国为拉美疫情防控提供有力支持,8小时前,中国经济网
164,城经网,世卫组织肯定中国疫情防控成果,13小时前,城经网
165,证券之星,OPEC月度报告:印度疫情改善将在下半年推动石油需求复苏,16小时前,证券之星
166,中国政府网,最新政策_疫情防控_中国政府网,16小时前,中国政府网
167,新浪财经,"这波印度疫情的大坑,把苹果和富士康陷进去了",16小时前,新浪财经
168,新浪财经,"印度疫情_印度疫情最新消息,新闻,图片,视频_聚合阅读_新浪网",17小时前,新浪财经
169,中金网,美国疫情_美国疫情的最新相关消息_中金网,18小时前,中金网
170,新浪财经,泰国总理:适当放宽疫情管控 经济和防疫之间需要平衡,19小时前,新浪财经
171,四海网,疫情:和疫情相关的精彩内容推荐_四海网,20小时前,四海网
172,大公网,世卫:中国正享受有效控制新冠疫情后的益处,21小时前,大公网
173,中金网,欧洲疫情_欧洲疫情的最新相关消息_中金网,22小时前,中金网
174,本地宝,广东肺炎疫情最新消息(每天更新),2021年5月11日,本地宝
175,本地宝,2021年全国疫情最新消息今天新增(持续更新),2021年5月11日,本地宝
176,风闻社区,"疫情失控美国却拒绝支援,印度该醒醒了!",2021年5月11日,风闻社区
177,本地宝,香港疫情最新消息(持续更新),2021年5月11日,本地宝
178,食品伙伴网,"近期疫情频发:中国首次发生重大非洲猪瘟疫情,多地发现炭疽疫情",2021年5月11日,食品伙伴网
179,本地宝,2021陕西疫情最新消息,2021年5月10日,本地宝
180,本地宝,2021重庆疫情最新消息(重庆+全国),2021年5月10日,本地宝
181,本地宝,南京新型冠状病毒疫情最新消息(持续更新),2021年5月10日,本地宝
182,西陆军事,"全球告急!又一疫情火药桶爆发了,倒了大血霉",2021年5月9日,西陆军事
183,大公网,印度疫情恶化对中国影响大吗?李兰娟院士回应,2021年5月8日,大公网
184,每经网,"疫情蔓延!印度一地方官员称:当地感染率或全国最高,最近几周,...",2021年5月8日,每经网
185,澎湃,"疫情蔓延却仍推进18亿美元工程,印度总理莫迪“惹怒”公众",2021年5月7日,澎湃
186,西陆军事,印度疫情突然爆炸的背后:五大影响直指中国!,2021年5月7日,西陆军事
187,本地宝,2021陕西境外输入疫情最新消息,2021年5月6日,本地宝
188,本地宝,全国疫情中高风险地区名单最新 (附查询方式),2021年5月6日,本地宝
189,本地宝,2021青岛疫情最新消息(持续更新),2021年5月6日,本地宝
190,东北网,黑龙江最新疫情通报-东北网黑龙江-东北网,2021年5月6日,东北网
191,黑龙江省人民政府,最新疫情通报,2021年5月6日,黑龙江省人民政府
192,华尔街见闻,印度疫情是如何一步步走到今天的?,2021年5月5日,华尔街见闻
193,扬子晚报网,"疫情防控时期,3人编造“华人有家难回”等多篇涉外疫情虚假信息获刑",2021年5月5日,扬子晚报网
194,www.pingwest.com,疫情中的印度:无助的患者和被击穿的医疗系统,1天前,www.pingwest.com
195,东北网,最新疫情通报-东北网黑龙江-东北网,2021年5月5日,东北网
196,中国经济网,多国疫情不容乐观 防疫乱象令人担忧,2021年5月5日,中国经济网
197,中国小康网,全国疫情中高风险区清零!5月4日全国疫情今天:31省区市新增确诊...,2021年5月4日,中国小康网
198,华尔街见闻,印度疫情急剧恶化:单日确诊近39万人!疫苗极度短缺!高峰可能还没...,2021年5月1日,华尔街见闻
199,本地宝,天津疫情最新消息(持续更新),2021年5月1日,本地宝
200,中国阜新,持续做好疫情防控工作,2021年4月30日,中国阜新
201,中国阜新,市疫情防控指挥部最新通告,2021年4月30日,中国阜新
202,今日中国,疫情动态_今日中国,2021年4月30日,今日中国
203,OFweek维科网,"疫情,什么是疫情?疫情的最新报道",2021年4月30日,OFweek维科网
204,西陆网,中国机遇来了?印度疫情失控对全球有4大影响,2021年4月29日,西陆网
205,本地宝,重庆疫情防控最新规定(持续更新),2021年4月29日,本地宝
206,中金在线,印度新冠疫情最新消息!美国务院建议在印美国公民尽快离境 此前纽约...,2021年4月29日,中金在线
207,武汉本地宝,2021年湖北疫情最新消息(持续更新),2021年4月29日,武汉本地宝
208,四海网,疫情严峻在印中国人还好吗?在印度的中国人目前现状如何,2021年4月29日,四海网
209,本地宝,上海疫情最新消息(每日更新),2021年4月29日,本地宝
210,新浪网,一周新增230万确诊 印度疫情怎么恶化成这样?,2021年4月29日,新浪网
211,石家庄市人民政府,马宇骏在市应对疫情工作领导小组调度会上指出,2021年4月29日,石家庄市人民政府
212,武汉本地宝,湖北疫情防控指挥部最新通告2021(持续更新),2021年4月29日,武汉本地宝
213,十堰秦楚网,"印度疫情迎来“至暗时刻”,在那里的中国人还好吗?",2021年4月29日,十堰秦楚网
214,新浪网,印度疫情是怎么“突然”全面失控的,2021年4月29日,新浪网
215,虎嗅网,印度疫情为什么爆炸?,2021年4月28日,虎嗅网
216,澎湃,"疫情下的印度:床位短缺,缺氧断气,人间地狱",2021年4月28日,澎湃
217,名城新闻网,"疫情形势复杂多变,多国出入境政策又有新变化!",2021年4月28日,名城新闻网
218,川观新闻,"疫情形势复杂多变,多国出入境政策又有新变化!",2021年4月28日,川观新闻
219,新浪网,印度疫情亲历者:眼睁睁看着这个国家变成“炼狱”,2021年4月27日,新浪网
220,中金在线,香港疫情最新消息!香港新增确诊8例 其中2人来自印度,2021年4月27日,中金在线
221,胶东在线,疫情严重 印度网友指责美国 把“伪善”“无法信任”打在了公屏上,2021年4月27日,胶东在线
222,虎嗅网,印度疫情亲历者:眼睁睁看着这个国家变成“炼狱”,2021年4月27日,虎嗅网
223,大众网,"“疫情已撼动整个国家!”印度疫情迅速恶化,多国表态愿提供援助",2021年4月27日,大众网
224,本地宝,2021云南瑞丽疫情最新消息(持续更新),2021年4月27日,本地宝
225,本地宝,瑞丽疫情最新消息2021(不断更新),2021年4月27日,本地宝
226,中金在线,印度疫情形势加剧恶化:全球严阵以待超级事件!市场情绪恐意外反转...,2021年4月26日,中金在线
227,一财网,印度新冠疫情催生黑市新品:一瓶氧气抵普通人半年工资,2021年4月26日,一财网
228,观察者网,"印度疫情悲惨一幕:找不到救护车,男子将父亲遗体绑车顶送去火葬",2021年4月26日,观察者网
229,观察者网,"印度疫情悲惨一幕:找不到救护车,男子将父亲遗体绑车顶送去火葬",2021年4月26日,观察者网
230,一财网,涨停复盘 | 印度疫情猛烈反扑 医疗概念逆市掀涨停潮,2021年4月26日,一财网
231,新浪财经网,"全球疫情大反弹,疫情背景之下的市场,印度或引爆两大行业,抱团股...",2021年4月26日,新浪财经网
232,河南日报,"去年因疫情受到冲击的郑州会展业今年迎来反弹,展会整体营收已恢复...",2021年4月26日,河南日报
233,大河网,疫情除了让“数字展会”站上风口还催生出哪些会展新题材?,2021年4月26日,大河网
234,证券时报网,"全球疫情大反弹,疫情背景之下的市场,印度或引爆两大行业,抱团股...",2021年4月26日,证券时报网
235,本地宝,2021年全国疫情风险等级地区名单(更新中),2021年4月25日,本地宝
236,西陆网,印疫情对全球4大占率影响!中国该出手了,2021年4月25日,西陆网
237,中国经济网,"印度疫情引发世界警惕,德媒:印政府仍拒绝分享自制疫苗数据,令人...",2021年4月25日,中国经济网
238,中国普法网,新型冠状病毒感染肺炎疫情当前防控工作,2021年4月22日,中国普法网
239,21经济网,疫情仍是影响经济关键变量 全球需面对流动性泛滥,2021年4月22日,21经济网
240,中国常德,市疫情防控指挥部2021年第8次会商会要求:抓好疫情常态化防控和疫...,2021年4月22日,中国常德
241,中金在线,"决策分析:市场情绪真的变了!疫情疑虑重燃打压人气,美元趁机反弹 ...",2021年4月21日,中金在线
242,上海有色网,【全球疫情数据追踪】第四波疫情迫在眉睫 印度疫情再度失控,2021年4月20日,上海有色网
243,联商网,"疫情之后,未来商业有哪些变化?",2021年4月19日,联商网
244,新浪,疫情年里 这四个中国品牌上榜全球最有价值时尚品牌名单,2021年4月19日,新浪
